SelleckChem007,SP0141-A,O07,CCT129202,S1519,CCT129202,10,m,7,15,25,192959335,497.02,942947-93-5,free base,Aurora Kinase,CCT129202 is an ATP-competitive pan-Aurora inhibitor for Aurora A; Aurora B and Aurora C with IC50 of 0.042 _M; 0.198 _M and 0.227 _M; respectively. It is less potent to FGFR3; GSK3_; PDGFR_; etc.,C1(=CN=C2C(=C1N3CCN(CC3)CC(NC4SC=CN=4)=O)N=C(N2)C5=CC=C(C=C5)N(C)C)Cl,6.04,http://www.selleckchem.com/products/CCT129202.html,Cell Cycle
SelleckChem007,SP0141-A,O08,Dofetilide ,S1658,Dofetilide ,10,m,8,15,25,192896769,441.56,115256-11-6,free base,Others,Dofetilide(Tikosyn) is a class III antiarrhythmic agent.,C1=C(C=CC(=C1)CCN(CCOC2=CC=C(C=C2)NS(C)(=O)=O)C)NS(C)(=O)=O,199,http://www.selleckchem.com/products/Dofetilide(Tikosyn).html,Others
SelleckChem007,SP0141-A,O09,Acipimox,S1806,Acipimox,10,m,9,15,25,192871088,154.12,51037-30-0,free base,Others,Acipimox is a niacin derivative used as a hypolipidemic agent.,C1=C([N+](=CC(=N1)C(=O)O)[O-])C,201,http://www.selleckchem.com/products/Acipimox.html,Others
SelleckChem007,SP0141-A,O10,Adenine HCl,S1983,Adenine HCl,10,m,10,15,25,192870705,171.59,2922-28-3,hydrochloride,DNA/RNA Synthesis,Adenine hydrochloride is a hydrochloride salt form of adenine which is a purine derivative and a nucleobase with a variety of roles in biochemistry.,C12(=C(C(=NC=N1)N)N=CN2).Cl,46,http://www.selleckchem.com/products/adenine-hydrochloride.html,DNA Damage
SelleckChem007,SP0141-A,O11,Dextrose,S2123,Dextrose,10,m,11,15,25,192869966,180.16,50-99-7,free base,Others,Dextrose; a simple sugar (monosaccharide); is an important carbohydrate in biology.,OC[C@H]([C@H]([C@@H]([C@H](C=O)O)O)O)O,199,http://www.selleckchem.com/products/Dextrose(D-glucose).html,Others
SelleckChem007,SP0141-A,O12,Bergenin,S2270,Bergenin,10,m,12,15,25,192873912,328.27,477-90-7,free base,Others,Bergenin is trihydroxybenzoic acid glycoside and the C-glycoside of 4-O-methyl gallic acid.,[C@H]1([C@H]([C@@H]([C@@]2([C@@](O1)(C3=C(C(O2)=O)C=C(C(=C3O)OC)O)[H])[H])O)O)CO,201,http://www.selleckchem.com/products/Bergenin-(Cuscutin).html,Others
SelleckChem007,SP0141-A,O13,Indirubin,S2386,Indirubin,10,m,13,15,25,194469229,262.26,479-41-4,free base,GSK-3,Indirubin is a potent cyclin-dependent kinases and GSK-3_ inhibitor with IC50 of about 5 &mu;M and 0.6 &mu;M.,C1=CC=C2C(=C1)NC(C/2=C3\NC4=C(C3=O)C=CC=C4)=O,202,http://www.selleckchem.com/products/Indirubin.html,PI3K/Akt/mTOR
SelleckChem007,SP0141-A,O14,Maprotiline HCl,S2517,Maprotiline HCl,10,m,14,15,25,192898008,313.86,10347-81-6,hydrochloride,Adrenergic Receptor,Maprotiline hydrochloride (Deprilept; Ludiomil; Psymion) is a selective noradrenalin re-uptake inhibitor and a tetracyclic antidepressant.,C1(=CC=C2C(=C1)C3(C4=C(C2CC3)C=CC=C4)CCCNC).Cl,200,http://www.selleckchem.com/products/Maprotiline-hydrochloride.html,Neuronal Signaling
SelleckChem007,SP0141-A,O15,A66,S2636,A66,10,m,15,15,25,192953366,393.53,1166227-08-2,free base,PI3K,A66 is a potent and specific p110_ inhibitor with IC50 of 32 nM; >100 fold selectivity for p110_ over other class-I PI3K isoforms.,C1SC(=NC=1C2SC(=NC=2C)NC(N3[C@@H](CCC3)C(=O)N)=O)C(C)(C)C,200,http://www.selleckchem.com/products/a66.html,PI3K/Akt/mTOR
SelleckChem007,SP0141-A,O16,I-BET151 (GSK1210151A),S2780,I-BET151 (GSK1210151A),10,m,16,15,25,194474966,415.44,1300031-49-5,free base,Epigenetic Reader Domain,I-BET151 (GSK1210151A) is a novel selective BET inhibitor for BRD2; BRD3 and BRD4 with IC50 of 0.5 _M; 0.25 _M; and 0.79 _M; respectively.,C1(=C(C=C2C(=C1)C3=C(C=N2)NC(N3[C@H](C)C4=CC=CC=N4)=O)C5=C(ON=C5C)C)OC,199,http://www.selleckchem.com/products/i-bet151-gsk1210151a.html,Epigenetics
SelleckChem007,SP0141-A,O17,Pirfenidone,S2907,Pirfenidone,10,m,17,15,25,192948868,185.22,53179-13-8,free base,TGF-beta/Smad,Pirfenidone is an inhibitor for TGF-_ production and TGF-_ stimulated collagen production; reduces production of TNF-_ and IL-1_; and also has anti-fibrotic and anti-inflammatory properties. Phase 3.,N1(C2C=CC=CC=2)C(C=CC(=C1)C)=O,199,http://www.selleckchem.com/products/pirfenidone.html,TGF-beta/Smad
SelleckChem007,SP0141-A,O18,Sodium salicylate,S3137,Sodium salicylate,10,m,18,15,25,192963465,161.11,54-21-7,salicylate,Others,Sodium salicylate is used in medicine as an analgesic and antipyretic.,C(C1C(=CC=CC=1)O)(=O)O.[Na],198,http://www.selleckchem.com/products/sodium-salicylate.html,Others
SelleckChem007,SP0141-A,O19,Sertraline HCl,S4053,Sertraline HCl,10,m,19,15,25,179700963,342.69,79559-97-0,hydrochloride,5-HT Receptor,Sertraline HCl is a 5-HT antagonist with Ki of 13 nM.,C12(=C([C@@H](CC[C@H]1NC)C3=CC=C(C(=C3)Cl)Cl)C=CC=C2).Cl,201,http://www.selleckchem.com/products/sertraline-hcl.html,Neuronal Signaling
SelleckChem007,SP0141-A,O20,Cetylpyridinium Chloride,S4172,Cetylpyridinium Chloride,10,m,20,15,25,192920859,339.99,123-03-5,chloride,Others,Cetylpyridinium chloride is a cationic quaternary ammonium compound used as oropharyngeal antiseptic.,[N+]1(=CC=CC=C1)CCCCCCCCCCCCCCCC.[Cl-],200,http://www.selleckchem.com/products/cetylpyridinium-chloride.html,Others
SelleckChem007,SP0141-A,O21,Etizolam,S4276,Etizolam,10,m,21,15,25,192916640,342.85,40054-69-1,Free Base,Others,"Etizolam is a specific platelet-activating factor (PAF) antagonist with anti-anxiety activity.   
SelleckChem007,SP0141-A,O22,Nomifensine Maleate,S4380,Nomifensine Maleate,10,m,22,15,25,192919840,354.4,32795-47-4,Neurological Disease,,,OC(=O)\C=C/C(O)=O.CN1CC(C2=CC=CC=C2)C2=CC=CC(N)=C2C1,,,,Does not exist on SelleckChem site
SelleckChem007,SP0141-A,P01,DMSO_P01,,DMSO_P01,,,1,16
SelleckChem007,SP0141-A,P02,DMSO_P02,,DMSO_P02,,,2,16
SelleckChem007,SP0141-A,P03,IPA-3,S7093,IPA-3,10,m,3,16,25,192900139,350.45,42521-82-4,free base,PAK,IPA-3 is a selective non-ATP competitive Pak1 inhibitor with IC50 of 2.5 _M; no inhibition to group II PAKs (PAKs 4-6).,S(SC1C(=CC=C2C=CC=CC=12)O)C3C(=CC=C4C=CC=CC=34)O,199,https://www.selleckchem.com/products/ipa-3.html,Cytoskeletal Signaling
SelleckChem007,SP0141-A,P04,PD173955,S7269,PD173955,10,m,4,16,25,194482557,443.35,260415-63-2,Free Base,BCR-ABL,PD173955 is a potent Bcr-Abl inhibitor with IC50 of 1-2 nM; also inhibiting Src activity with IC50 of 22 nM.,C1(C(=CC2C(N1C)N=C(N=C2)NC3=CC=CC(=C3)SC)C4=C(C=CC=C4Cl)Cl)=O,15,www.selleckchem.com/products/pd173955.html,Angiogenesis
SelleckChem007,SP0141-A,P05,PI-1840,S7462,PI-1840,10,m,5,16,25,192885245,394.47,1401223-22-0,Free Base,Proteasome,"PI-1840 is a reversible and selective chymotrypsin-like (CT-L) inhibitor with IC50 of 27 nM with little effects on the other two major proteasome proteolytic activities; trypsin-like (T-L) and postglutamyl-peptide-hydrolysis-like (PGPH-L).
SelleckChem007,SP0141-A,P06,Optovin,S8073,Optovin,10,m,6,16,25,192930178,315.41,348575-88-2,Free Base,Others,"Optovin is a reversible photoactivated TRPA1 activator.
