SelleckChem004,SP0138-A,L13,Purmorphamine,S3042,Purmorphamine,10,m,13,12,25,179709076,520.62,483367-10-8,free base,Hedgehog/Smoothened,Purmorphamine; which directly binds and activates Smoothened; blocks BODIPY-cyclopamine binding to Smo with IC50 of ~ 1.5 _M and also is an inducer of osteoblast differentiation with EC50 of 1 _M.,C12=C(C(NC3=CC=C(N4CCOCC4)C=C3)=NC(=N1)OC5=C6C(C=CC=C6)=CC=C5)N=CN2C7CCCCC7,7.68,http://www.selleckchem.com/products/purmorphamine.html,Stem Cells &  Wnt,,L1700-Selleck-Bioactive-Compound-Library
SelleckChem004,SP0138-A,L14,Pergolide mesylate,S4000,Pergolide mesylate,10,m,14,12,25,179680656,410.59,66104-23-2,mesylate,Dopamine Receptor,Pergolide mesylate is an antiparkinsonian agent which functions as a dopaminergic agonist.,C12(C3[C@@]4([C@@](CC1=CNC=2C=CC=3)(N(C[C@H](C4)CSC)CCC)[H])[H]).CS(O)(=O)=O,24,http://www.selleckchem.com/products/Pergolide-mesylate.html,Neuronal Signaling,,L1700-Selleck-Bioactive-Compound-Library
SelleckChem004,SP0138-A,L15,Azelnidipine,S3053,Azelnidipine,10,m,15,12,25,192954356,582.65,123524-52-7,free base,Calcium Channel,Azelnidipine is a dihydropyridine calcium channel blocker.,C1(=C(C(C(=C(N1)C)C(=O)OC(C)C)C2C=C(C=CC=2)[N+](=O)[O-])C(=O)OC3CN(C3)C(C4C=CC=CC=4)C5C=CC=CC=5)N,200,http://www.selleckchem.com/products/azelnidipine.html,Transmembrane Transporters,,L1700-Selleck-Bioactive-Compound-Library
SelleckChem004,SP0138-A,L16,Acebutolol HCl,S4010,Acebutolol HCl,10,m,16,12,25,179681705,372.89,34381-68-5,hydrochloride,Adrenergic Receptor,Acebutolol is a _-adrenergic receptors antagonist used in the treatment of hypertension; angina pectoris and cardiac arrhythmias.,C1(=C(C=C(C=C1)NC(CCC)=O)C(C)=O)OCC(CNC(C)C)O.Cl,201,http://www.selleckchem.com/products/acebutolol-hcl.html,Neuronal Signaling,,L1700-Selleck-Bioactive-Compound-Library
SelleckChem004,SP0138-A,L17,Naloxone HCl,S3066,Naloxone HCl,10,m,17,12,25,192925552,363.84,357-08-4,hydrochloride,Opioid Receptor,Naloxone HCl is an opioid inverse agonist drug used to counter the effects of opiate overdose.,C12([C@]34[C@@]5([C@@H](CC=1C=CC(=C2O[C@]3(C(CC5)=O)[H])O)N(CC4)CC=C)O).Cl,200,http://www.selleckchem.com/products/naloxone-hcl.html,Neuronal Signaling,,L1700-Selleck-Bioactive-Compound-Library
SelleckChem004,SP0138-A,L18,Sodium Picosulfate,S4020,Sodium Picosulfate,10,m,18,12,25,192896100,481.41,10040-45-6,sodium,Others,Sodium Picosulfate inhibits absorption of water and electrolytes; and increases their secretion.,C(C1=CC=C(C=C1)OS(=O)(=O)[O-])(C2C=CC(=CC=2)OS(=O)(=O)[O-])C3(=CC=CC=N3).[Na+].[Na+],199,http://www.selleckchem.com/products/sodium-picosulfate.html,Others,,L1700-Selleck-Bioactive-Compound-Library
SelleckChem004,SP0138-A,L19,Atovaquone,S3079,Atovaquone,10,m,19,12,25,192942768,366.84,95233-18-4,free base,Others,Atovaquone is a medication used to treat or prevent for pneumocystis pneumonia; toxoplasmosis; malaria; and babesia.,C1([C@@H]2CC[C@H](CC2)C3=CC=C(C=C3)Cl)C(C4=C(C(C=1O)=O)C=CC=C4)=O,13,http://www.selleckchem.com/products/atovaquone-atavaquone.html,Others,,L1700-Selleck-Bioactive-Compound-Library
SelleckChem004,SP0138-A,L20,Aclidinium Bromide,S4031,Aclidinium Bromide,10,m,20,12,25,179618885,564.55,320345-99-1,free base,AChR,Aclidinium Bromide inhibits human muscarinic AChR M1; M2; M3; M4 and M5 with Ki of 0.1 nM; 0.14 nM; 0.14 nM; 0.21 nM and 0.16 nM; respectively.,C(C(O[C@H]1C[N+]2(CCCOC3C=CC=CC=3)CCC1(CC2)[H])=O)(C4SC=CC=4)(C5SC=CC=5)O.[Br-],200,http://www.selleckchem.com/products/aclidinium-bromide.html,Neuronal Signaling,,L1700-Selleck-Bioactive-Compound-Library
SelleckChem004,SP0138-A,L21,Pyridoxine HCl ,S3113,Pyridoxine HCl ,10,m,21,12,25,192931785,205.64,58-56-0,hydrochloride,Others,Pyridoxine HCl is a form of vitamin B6.,C1(C(=C(C(=C(N=1)C)O)CO)CO).Cl,199,http://www.selleckchem.com/products/pyridoxine-hydrochloride.html,Others,,L1700-Selleck-Bioactive-Compound-Library
SelleckChem004,SP0138-A,L22,Nafcillin Sodium,S4042,Nafcillin Sodium,10,m,22,12,25,192882259,454.47,7177-50-6,free base,Others,Nafcillin sodium reversibly inhibits _-lactamase with Kd of 33 mM.,C12(=C(C=CC(=C1C(N[C@@H]3C(N4[C@@]3(SC([C@H]4C(=O)O[Na])(C)C)[H])=O)=O)OCC)C=CC=C2).O,200,http://www.selleckchem.com/products/nafcillin-sodium.html,Others,,L1700-Selleck-Bioactive-Compound-Library
SelleckChem004,SP0138-A,L23,LPS_L23,,LPS_L23,,,23,12,,,,,,,,,,,,,L1700-Selleck-Bioactive-Compound-Library
SelleckChem004,SP0138-A,L24,LPS_L24,,LPS_L24,,,24,12,,,,,,,,,,,,,L1700-Selleck-Bioactive-Compound-Library
SelleckChem004,SP0138-A,M03,MK-0752,S2660,MK-0752,10,m,3,13,25,192896028,442.9,471905-41-6,free base,Gamma-secretase;Beta Amyloid,MK-0752 is a moderately potent _-secretase inhibitor; which reduces A_40 production with IC50 of 5 nM. Phase 1/2.,C1=CC(=CC=C1Cl)S([C@]2(CC[C@H](CC2)CCC(=O)O)C3=C(C=CC(=C3)F)F)(=O)=O,200,http://www.selleckchem.com/products/mk-0752.html,Proteases,,L1700-Selleck-Bioactive-Compound-Library
SelleckChem004,SP0138-A,M04,Tofacitinib (CP-690550;Tasocitinib),S2789,Tofacitinib (CP-690550;Tasocitinib),10,m,4,13,25,194474903,312.37,477600-75-2,free base,JAK,Tofacitinib is a novel inhibitor of JAK3 with IC50 of 1 nM; 20- to 100-fold less potent against JAK2 and JAK1.,N1=CN=C2C(=C1N(C)[C@H]3CN(CC[C@@H]3C)C(=O)CC#N)C=CN2,198,http://www.selleckchem.com/products/tofacitinib-cp-690550.html,JAK/STAT,,L1700-Selleck-Bioactive-Compound-Library
SelleckChem004,SP0138-A,M05,A-674563,S2670,A-674563,10,m,5,13,25,179618699,358.44,552325-73-2,free base,PKA;CDK;Akt,A-674563 is an Akt1 inhibitor with Ki of 11 nM; modest potent to PKA and >30-fold selective for Akt1 over PKC.,C1=CC=CC(=C1)C[C@@H](COC2=CC(=CN=C2)C3=CC4=C(C=C3)NN=C4C)N,200,http://www.selleckchem.com/products/a-674563.html,PI3K/Akt/mTOR,,L1700-Selleck-Bioactive-Compound-Library
SelleckChem004,SP0138-A,M06,AZD4547,S2801,AZD4547,10,m,6,13,25,192944597,463.57,1035270-39-3,free base,FGFR,AZD4547 is a novel selective FGFR inhibitor targeting FGFR1/2/3 with IC50 of 0.2 nM/2.5 nM/1.8 nM; weaker activity against FGFR4; VEGFR2(KDR); and little activity observed against IGFR; CDK2; and p38. Phase 1/2.,C1(=CC(=CC(=C1)CCC2=CC(=NN2)NC(=O)C3=CC=C(C=C3)N4C[C@@H](N[C@@H](C4)C)C)OC)OC,198,http://www.selleckchem.com/products/azd4547.html,Angiogenesis,,L1700-Selleck-Bioactive-Compound-Library
SelleckChem004,SP0138-A,M07,AS-604850,S2681,AS-604850,10,m,7,13,25,192953344,285.22,648449-76-7,free base,PI3K,AS-604850 is a selective; ATP-competitive PI3K_ inhibitor with IC50 of 250 nM; over 80-fold selectivity for PI3K_ than PI3K_/_; and 18-fold more selective for PI3K_ than PI3K_.,C12=C(C=CC(=C1)/C=C3\SC(NC3=O)=O)OC(O2)(F)F,199,http://www.selleckchem.com/products/as-604850.html,PI3K/Akt/mTOR,,L1700-Selleck-Bioactive-Compound-Library
SelleckChem004,SP0138-A,M08,AT101,S2812,AT101,10,m,8,13,25,179766375,578.61,866541-93-7,free base,Bcl-2,AT101; the R-(-) enantiomer of Gossypol acetic acid; binds with Bcl-2; Bcl-xL and Mcl-1 with Ki of 0.32 _M; 0.48 _M and 0.18 _M; does not inhibit BIR3 domain and BID. Phase 1/2.,C1(C(=C(C=C2C(=C(C(=C(C=12)C=O)O)O)C(C)C)C)C3=C(C4C(=C(C(=C(C(C=C3C)=4)C(C)C)O)O)C=O)O)O.C(C)(=O)O,200,http://www.selleckchem.com/products/at101.html,Apoptosis,,L1700-Selleck-Bioactive-Compound-Library
SelleckChem004,SP0138-A,M09,ADX-47273,S2690,ADX-47273,10,m,9,13,25,181366194,369.36,851881-60-2,free base,GluR,ADX47273 is a potent and specific mGlu5 positive allosteric modulator(PAM) with EC50 of 0.17 _M; showing no activity at other mGlu subtypes.,C1(=CC=C(C=C1)C(N2CCC[C@@H](C2)C3=NC(=NO3)C4=CC=C(C=C4)F)=O)F,200,http://www.selleckchem.com/products/adx-47273.html,Neuronal Signaling,,L1700-Selleck-Bioactive-Compound-Library
SelleckChem004,SP0138-A,M10,RG108,S2821,RG108,10,m,10,13,25,194474964,334.33,48208-26-0,free base,Transferase;DNA Methyltransferase,RG108 is an inhibitor of DNA methyltransferase with IC50 of 115 nM; does not cause trapping of covalent enzymes.,[C@@](N1C(C2=CC=CC=C2C1=O)=O)(CC3C4=C(NC=3)C=CC=C4)(C(O)=O)[H],200,http://www.selleckchem.com/products/rg108.html,Epigenetics,,L1700-Selleck-Bioactive-Compound-Library
SelleckChem004,SP0138-A,M11,CH5132799,S2699,CH5132799,10,m,11,13,25,194487444,377.42,1007207-67-1,free base,mTOR;PI3K,CH5132799 inhibits class I PI3Ks; particularly PI3K_ with IC50 of 14 nM; less potent to PI3K___; while sensitive in PIK3CA mutations cell lines. Phase 1.,N1=C(N=CC(=C1)C2=C3C(=NC(=N2)N4CCOCC4)N(CC3)S(C)(=O)=O)N,31,http://www.selleckchem.com/products/ch5132799.html,PI3K/Akt/mTOR,,L1700-Selleck-Bioactive-Compound-Library
SelleckChem004,SP0138-A,M12,SAR131675,S2842,SAR131675,10,m,12,13,25,192898993,358.39,1433953-83-3,free base,VEGFR,SAR131675 is a VEGFR3 inhibitor with IC50/Ki of 23 nM/12 nM; about 50- and 10-fold more selective for VEGFR3 than VEGFR1/2; little activity against Akt1; CDKs; PLK1; EGFR; IGF-1R; c-Met; Flt2 etc.,C12C(N(C(=C(C1=O)C(NC)=O)N)CC)=NC(=CC=2)C#C[C@](O)(C)COC,83,http://www.selleckchem.com/products/sar131675.html,Protein Tyrosine Kinase,,L1700-Selleck-Bioactive-Compound-Library
SelleckChem004,SP0138-A,M13,AMG-900,S2719,AMG-900,10,m,13,13,25,192893053,503.58,945595-80-2,free base,Aurora Kinase,AMG 900 is a potent and highly selective pan-Aurora kinases inhibitor for Aurora A/B/C with IC50 of 5 nM/4 nM /1 nM. It is >10-fold selective for Aurora kinases than p38_; Tyk2; JNK2; Met and Tie2. Phase 1.,C1=CC(=C(N=C1)OC2=CC=C(C=C2)NC3C4=C(C(=NN=3)C5SC=C(C=5)C)C=CC=C4)C6=NC(=NC=C6)N,198,http://www.selleckchem.com/products/amg-900.html,Cell Cycle,,L1700-Selleck-Bioactive-Compound-Library
SelleckChem004,SP0138-A,M14,BML-190,S2854,BML-190,10,m,14,13,25,192917750,426.89,2854-32-2,free base,Cannabinoid Receptor,BML-190 is a selective cannabinoid CB2 receptor inverse agonist with Ki of 435 nM; with 50-fold selectivity over CB1 receptor.,C(CC1=C(N(C2C=CC(=CC1=2)OC)C(C3C=CC(=CC=3)Cl)=O)C)(N4CCOCC4)=O,51,http://www.selleckchem.com/products/bml-190.html,GPCR & G Protein,,L1700-Selleck-Bioactive-Compound-Library
SelleckChem004,SP0138-A,M15,Crenolanib (CP-868596),S2730,Crenolanib (CP-868596),10,m,15,13,25,192941575,443.54,670220-88-9,free base,PDGFR,Crenolanib (CP-868596) is a potent and selective inhibitor of PDGFR_/_ with Kd of 2.1 nM/3.2 nM; also potently inhibits FLT3; sensitive to D842V mutation not V561D mutation; >100-fold more selective for PDGFR than c-Kit; VEGFR-2; TIE-2; FGFR-2; EGFR; erbB2; and Src.,C1=CC(=C2C(=C1)C=CC(=N2)N3C=NC4=C3C=CC(=C4)OCC5(COC5)C)N6CCC(CC6)N,200,http://www.selleckchem.com/products/crenolanib-cp-868596.html,Protein Tyrosine Kinase,,L1700-Selleck-Bioactive-Compound-Library
SelleckChem004,SP0138-A,M16,VU 0364770,S2862,VU 0364770,10,m,16,13,25,181344006,232.67,61350-00-3,free base,GluR,VU 0364770 is a positive allosteric modulator(PAM) of mGlu4 with EC50 of 1.1 _M; exhibits insignificant activity at 68 other receptors; including other mGlu subtypes.,C1(C=CC=CN=1)C(=O)NC2C=C(C=CC=2)Cl,202,http://www.selleckchem.com/products/vu-0364770.html,Neuronal Signaling,,L1700-Selleck-Bioactive-Compound-Library
SelleckChem004,SP0138-A,M17,AZ 628,S2746,AZ 628,10,m,17,13,25,192943305,451.52,878739-06-1,free base,Raf,AZ628 is a new pan-Raf inhibitor for BRAF; BRAFV600E; and c-Raf-1 with IC50 of 105 nM; 34 nM and 29 nM; also inhibits VEGFR2; DDR2; Lyn; Flt1; FMS; etc.,C1(=CC=CC(=C1)C(NC2=CC=C(C(=C2)NC3=CC4=C(C=C3)N=CN(C4=O)C)C)=O)C(C#N)(C)C,199,http://www.selleckchem.com/products/az628.html,MAPK,,L1700-Selleck-Bioactive-Compound-Library
SelleckChem004,SP0138-A,M18,T0070907,S2871,T0070907,10,m,18,13,25,192899907,277.66,313516-66-4,free base,PPAR,T0070907 is a potent and selective PPAR_ inhibitor with IC50 of 1 nM; with a >800-fold selectivity over PPAR_ and PPAR_.,C(C1C(=CC=C(C=1)[N+](=O)[O-])Cl)(=O)NC2C=CN=CC=2,93,http://www.selleckchem.com/products/t0070907.html,DNA Damage,,L1700-Selleck-Bioactive-Compound-Library
SelleckChem004,SP0138-A,M19,Wortmannin,S2758,Wortmannin,10,m,19,13,25,192898748,428.43,19545-26-7,free base,Autophagy;ATM/ATR;PI3K,Wortmannin is a PI3K with IC50 of 3 nM; first described PI3K inhibitors; but little selectivity within the PI3K family. Also blocks autophagosome formation and potently inhibits DNA-PK/ATM with IC50 of 16 nM and 150 nM. Phase 4.,C1(C2C3[C@]([C@H](O1)COC)(C4=C(C(C=3OC=2)=O)[C@@]5(CCC([C@@](C[C@@H]4OC(=O)C)5C)=O)[H])C)=O,200,http://www.selleckchem.com/products/wortmannin.html,PI3K/Akt/mTOR,,L1700-Selleck-Bioactive-Compound-Library
SelleckChem004,SP0138-A,M20,A-205804,S2885,A-205804,10,m,20,13,25,179724506,300.4,251992-66-2,free base,Others,A-205804 is a potent and selective inhibitor of E-selectin and ICAM-1 expression with IC50 of 20 nM and 25 nM respectively.,C12=C(C(=CN=C1)SC3=CC=C(C=C3)C)C=C(S2)C(=O)N,199,http://www.selleckchem.com/products/a-205804.html,Others,,L1700-Selleck-Bioactive-Compound-Library
SelleckChem004,SP0138-A,M21,MK-5108 (VX-689),S2770,MK-5108 (VX-689),10,m,21,13,25,192889699,461.94,1010085-13-8,free base,Aurora Kinase,MK-5108 (VX-689) is a highly selective Aurora A inhibitor with IC50 of 0.064 nM and is 220- and 190-fold more selective for Aurora A than Aurora B/C; while it inhibits TrkA with less than 100-fold selectivity. Phase 1.,N1=C(C=CC=C1C[C@]2(CC[C@H](CC2)OC3=C(C(=CC=C3)Cl)F)C(=O)O)NC4SC=CN=4,199,http://www.selleckchem.com/products/mk-5108-vx-689.html,Cell Cycle,,L1700-Selleck-Bioactive-Compound-Library
SelleckChem004,SP0138-A,M22,GNF-2,S2899,GNF-2,10,m,22,13,25,194475456,374.32,778270-11-4,free base,Bcr-Abl,GNF-2 is a highly selective non-ATP competitive inhibitor of Bcr-Abl; shows no activity to Flt3-ITD; Tel-PDGFR; TPR-MET and Tel-JAK1 transformed tumor cells.,C1=CC(=CC(=C1)C(=O)N)C2=NC=NC(=C2)NC3=CC=C(C=C3)OC(F)(F)F,200,http://www.selleckchem.com/products/gnf-2.html,Angiogenesis,,L1700-Selleck-Bioactive-Compound-Library
SelleckChem004,SP0138-A,M23,LPS_M23,,LPS_M23,,,23,13,,,,,,,,,,,,,L1700-Selleck-Bioactive-Compound-Library
SelleckChem004,SP0138-A,M24,LPS_M24,,LPS_M24,,,24,13,,,,,,,,,,,,,L1700-Selleck-Bioactive-Compound-Library
SelleckChem004,SP0138-A,N03,ML161,S2916,ML161,10,m,3,14,25,192918173,361.23,423735-93-7,free base,Others,ML-161 is an allosteric inhibitor of PAR1 with IC50 of 0.26 _M.,C1=CC=C(C(=C1)C(NC2=CC(=CC=C2)NC(CCC)=O)=O)Br,199,http://www.selleckchem.com/products/ml-161.html,Others,,L1700-Selleck-Bioactive-Compound-Library
SelleckChem004,SP0138-A,N04,Estradiol valerate,S3149,Estradiol valerate,10,m,4,14,25,179619609,356.5,979-32-8,free base,Estrogen/progestogen Receptor,Estradiol is a synthetic ester used to treat menopausal symptoms and hormone deficiencies.,C1=C(C=C2C(=C1)[C@]3([C@@](CC2)([C@]4([C@](CC3)([C@@H](CC4)OC(CCCC)=O)C)[H])[H])[H])O,199,http://www.selleckchem.com/products/estradiol-valerate.html,Endocrinology & Hormones,,L1700-Selleck-Bioactive-Compound-Library
SelleckChem004,SP0138-A,N05,Apoptosis Activator 2,S2927,Apoptosis Activator 2,10,m,5,14,25,192917947,306.14,79183-19-0,free base,Caspase,Apoptosis Activator 2 strongly induces caspase-3 activation; PARP cleavage; and DNA fragmentation which leads to the destruction of cells (Apaf-1 dependent) with IC50 of ~4 _M; inactive to HMEC; PREC; or MCF-10A cells.,C12=C(C=CC=C1)N(C(C2=O)=O)CC3=CC(=C(C=C3)Cl)Cl,199,http://www.selleckchem.com/products/apoptosis-activator-2.html,Apoptosis,,L1700-Selleck-Bioactive-Compound-Library
SelleckChem004,SP0138-A,N06,Benztropine mesylate,S3163,Benztropine mesylate,10,m,6,14,25,179619152,403.53,132-17-2,mesylate,Histamine Receptor,Benztropine is a dopamine transporter (DAT) inhibitor with IC50 of 118 nM.,C1(C[C@@H]2C[C@@H](C[C@@H]1N2C)OC(C3=CC=CC=C3)C4=CC=CC=C4).CS(=O)(=O)O,123,http://www.selleckchem.com/products/benztropine-mesylate.html,Neuronal Signaling,,L1700-Selleck-Bioactive-Compound-Library
SelleckChem004,SP0138-A,N07,Zanamivir,S3007,Zanamivir,10,m,7,14,25,192865317,332.31,139110-80-8,free base,Others,Zanamivir is a neuraminidase inhibitor used in the treatment and prophylaxis of influenza caused by influenza A virus and influenza B virus.,[C@@H]1(C=C(O[C@]([C@H]1NC(C)=O)([C@H](O)[C@H](O)CO)[H])C(=O)O)NC(=N)N,75.23,http://www.selleckchem.com/products/zanamivir-relenza.html,Others,,L1700-Selleck-Bioactive-Compound-Library
SelleckChem004,SP0138-A,N08,Carbenicillin disodium,S3179,Carbenicillin disodium,10,m,8,14,25,192882111,422.36,4800-94-6,disodium,Others,Carbenicillin is a semi-synthetic penicillin antibiotic which interferes with cell wall synthesis of gram-negative bacteria while displaying low toxicity.,N12([C@H](C(S[C@]([C@@H](C1=O)NC(=O)C(C3C=CC=CC=3)C(=O)[O-])2[H])(C)C)C(=O)[O-]).[Na+].[Na+],11,http://www.selleckchem.com/products/carbenicillin-disodium.html,Others,,L1700-Selleck-Bioactive-Compound-Library
SelleckChem004,SP0138-A,N09,Rimonabant,S3021,Rimonabant,10,m,9,14,25,192899514,463.79,168273-06-1,free base,Cannabinoid Receptor,Rimonabant is a selective antagonist of CB1 with IC50 of 13.6 nM and EC50 of 17.3 nM in hCB1 transfected HEK 293 membrane.,N1(N=C(C(=C1C2C=CC(=CC=2)Cl)C)C(=O)NN3CCCCC3)C4C(=CC(=CC=4)Cl)Cl,53,http://www.selleckchem.com/products/rimonabant-sr141716.html,GPCR & G Protein,,L1700-Selleck-Bioactive-Compound-Library
SelleckChem004,SP0138-A,N10,N6-methyladenosine (m6A),S3190,N6-methyladenosine (m6A),10,m,10,14,25,192892228,281.27,1867-73-8,free base,Others,N6-methyl adenosine (N6-methyl ATP) is a base modified analog of adenosine and is found as a minor nucleoside in natural RNAs.,OC[C@@H]1[C@@H](O)[C@@H](O)[C@@H](O1)N2C=NC3C(NC)=NC=NC=32,199.1,http://www.selleckchem.com/products/n6-methyladenosine.html,Others,,L1700-Selleck-Bioactive-Compound-Library
SelleckChem004,SP0138-A,N11,Bindarit ,S3032,Bindarit ,10,m,11,14,25,192866460,324.37,130641-38-2,free base,Others,Bindarit exhibits selective inhibition against monocyte chemotactic proteins MCP-1/CCL2; MCP-3/CCL7 and MCP-2/CCL8.,C(C(C)(OCC1=NN(C2C=CC=CC1=2)CC3C=CC=CC=3)C)(=O)O,200,http://www.selleckchem.com/products/bindarit.html,Others,,L1700-Selleck-Bioactive-Compound-Library
SelleckChem004,SP0138-A,N12,Meptazinol HCl,S3204,Meptazinol HCl,10,m,12,14,25,192882065,269.81,59263-76-2,hydrochloride,Others,Meptazinol is a unique centrally active opioid analgesic; which inhibits [3H]dihydromorphine binding with IC50 of 58 nM.,C1(C=C(C=CC=1)C2(CN(CCCC2)C)CC)O.Cl,200,http://www.selleckchem.com/products/meptazinol-hydrochloride.html,Others,,L1700-Selleck-Bioactive-Compound-Library
SelleckChem004,SP0138-A,N13,Rofecoxib ,S3043,Rofecoxib ,10,m,13,14,25,192942775,314.36,162011-90-7,free base,COX,Rofecoxib is a COX-2 inhibitor with IC50 of 18 nM.,C1=C(C=CC(=C1)C2=C(C(OC2)=O)C3=CC=CC=C3)S(C)(=O)=O,200,http://www.selleckchem.com/products/rofecoxib-vioxx.html,Neuronal Signaling,,L1700-Selleck-Bioactive-Compound-Library
SelleckChem004,SP0138-A,N14,Cabozantinib malate (XL184),S4001,Cabozantinib malate (XL184),10,m,14,14,25,192961384,635.59,1140909-48-3,Malate,VEGFR,Cabozantinib malate is the malate of Cabozantinib; a potent VEGFR2 inhibitor with IC50 of 0.035 nM and also inhibits c-Met; Ret; Kit; Flt-1/3/4; Tie2; and AXL with IC50 of 1.3 nM; 4 nM; 4.6 nM; 12 nM/11.3 nM/6 nM; 14.3 nM and 7 nM; respectively.,C12(=C(C(=CC=N1)OC3=CC=C(C=C3)NC(C4(C(NC5=CC=C(C=C5)F)=O)CC4)=O)C=C(C(=C2)OC)OC).C(C[C@H](O)C(=O)O)(=O)O,100,www.selleckchem.com/products/cabozantinib-malate.html,Protein Tyrosine Kinase,,L1700-Selleck-Bioactive-Compound-Library
SelleckChem004,SP0138-A,N15,Alverine Citrate,S3054,Alverine Citrate,10,m,15,14,25,192943004,473.56,5560-59-8,citrate,Others,Alverine citrate is a drug used for functional gastrointestinal disorders.,C1(C=CC=CC=1)CCCN(CCCC2C=CC=CC=2)CC.C(C(CC(=O)O)(C(=O)O)O)C(=O)O,200.61,http://www.selleckchem.com/products/alverine-citrate.html,Others,,L1700-Selleck-Bioactive-Compound-Library
SelleckChem004,SP0138-A,N16,Ampiroxicam,S4011,Ampiroxicam,10,m,16,14,25,179605325,447.46,99464-64-9,free base,COX,Ampiroxicam is a nonselective cyclooxygenase inhibitor uesd as anti-inflammatory drug.,C1(C2=C(S(N(C=1C(NC3C=CC=CN=3)=O)C)(=O)=O)C=CC=C2)OC(OC(OCC)=O)C,201,http://www.selleckchem.com/products/ampiroxicam.html,Neuronal Signaling,,L1700-Selleck-Bioactive-Compound-Library
SelleckChem004,SP0138-A,N17,Chlorhexidine HCl,S3067,Chlorhexidine HCl,10,m,17,14,25,192916447,578.37,3697-42-5,HCl,Others,Chlorhexidine hydrochloride is an antiseptic effective against a wide variety of gram-negative and gram-positive organisms.,C(NC(NCCCCCCNC(NC(=N)NC1C=CC(=CC=1)Cl)=N)=N)(=N)NC2(C=CC(=CC=2)Cl).Cl.Cl,100,www.selleckchem.com/products/chlorhexidine-hcl.html,Others,,L1700-Selleck-Bioactive-Compound-Library
SelleckChem004,SP0138-A,N18,Tolcapone,S4021,Tolcapone,10,m,18,14,25,179604479,273.24,134308-13-7,free base,Transferase,Tolcapone is a selective; potent and reversible of catechol-O-methyl transferase (COMT) inhibitor with Ki of 30 nM.,C1(C(C2=CC=C(C=C2)C)=O)C=C(C(=C(C=1)O)O)[N+](=O)[O-],201,http://www.selleckchem.com/products/tolcapone.html,Metabolism,,L1700-Selleck-Bioactive-Compound-Library
SelleckChem004,SP0138-A,N19,Etravirine (TMC125),S3080,Etravirine (TMC125),10,m,19,14,25,192865990,435.28,269055-15-4,free base,Reverse Transcriptase,Etravirine (TMC125) is a non-nucleoside reverse transcriptase inhibitor (NNRTI) used for the treatment of HIV.,C1(N=C(N=C(C=1Br)N)NC2C=CC(C#N)=CC=2)OC3C(=CC(C#N)=CC=3C)C,96,http://www.selleckchem.com/products/etravirine-tmc125.html,Microbiology,,L1700-Selleck-Bioactive-Compound-Library
SelleckChem004,SP0138-A,N20,Diphemanil Methylsulfate,S4034,Diphemanil Methylsulfate,10,m,20,14,25,179618430,389.51,62-97-5,methylsulfate,AChR,Diphemanil Methylsulfate is a quaternary ammonium anticholinergic; it binds muscarinic acetycholine receptors (mAchR).,C(=C1CC[N+](CC1)(C)C)(C2=CC=CC=C2)C3(C=CC=CC=3).S(OC)(=O)(=O)[O-],64,http://www.selleckchem.com/products/diphemanil-methylsulfate.html,Neuronal Signaling,,L1700-Selleck-Bioactive-Compound-Library
SelleckChem004,SP0138-A,N21,Vitamin C,S3114,Vitamin C,10,m,21,14,25,192931671,176.12,50-81-7,free base,Others,Vitamin C is a water-soluble vitamin indicated for the prevention and treatment of scurvy.,OC1[C@@H]([C@@H](O)CO)OC(=O)C(O)=1,198,http://www.selleckchem.com/products/vitamin-c-ascorbic-acid.html,Others,,L1700-Selleck-Bioactive-Compound-Library
SelleckChem004,SP0138-A,N22,Tetrahydrozoline HCl,S4043,Tetrahydrozoline HCl,10,m,22,14,25,179615869,236.74,522-48-5,free base,Adrenergic Receptor,Tetrahydrozoline HCl is an imidazoline derivative with alpha receptor agonist activity.,N1(=C(NCC1)C2C3=CC=CC=C(CCC2)3).Cl,50,http://www.selleckchem.com/products/tetrahydrozoline-hcl.html,Neuronal Signaling,,L1300-Selleck-FDA-Approved-Drug-Library
SelleckChem004,SP0138-A,N23,LPS_N23,,LPS_N23,,,23,14,,,,,,,,,,,,,L1700-Selleck-Bioactive-Compound-Library
SelleckChem004,SP0138-A,N24,LPS_N24,,LPS_N24,,,24,14,,,,,,,,,,,,,L1700-Selleck-Bioactive-Compound-Library
SelleckChem004,SP0138-A,O03,WYE-125132 (WYE-132),S2661,WYE-125132 (WYE-132),10,m,3,15,25,192898176,519.6,1144068-46-1,free base,mTOR,WYE-125132 is a highly potent; ATP-competitive mTOR inhibitor with IC50 of 0.19 nM; highly selective for mTOR versus PI3Ks or PI3K-related kinases hSMG1 and ATR.,C1(=NC(=NC2=C1C=NN2C3CCC4(CC3)OCCO4)C5=CC=C(C=C5)NC(=O)NC)N6CC7CCC(O7)C6,200,http://www.selleckchem.com/products/wye-125132.html,PI3K/Akt/mTOR,,L1700-Selleck-Bioactive-Compound-Library
SelleckChem004,SP0138-A,O04,Istradefylline,S2790,Istradefylline,10,m,4,15,25,192948092,384.43,155270-99-8,free base,Others,Istradefylline is a selective adenosine A2A receptor (A2AR) antagonist with Ki of 2.2 nM.,N1(C(=NC2N(C(N(C(C1=2)=O)CC)=O)CC)/C=C/C3C=C(C(=CC=3)OC)OC)C,15,http://www.selleckchem.com/products/istradefylline-kw-6002.html,Others,,L1700-Selleck-Bioactive-Compound-Library
SelleckChem004,SP0138-A,O05,AS-252424,S2671,AS-252424,10,m,5,15,25,192900905,305.28,900515-16-4,free base,PI3K,AS-252424 is a novel; potent PI3K_ inhibitor with IC50 of 30 nM with 30-fold selectivity for PI3K_ than PI3K_; and low inhibitory activity towards PI3K_/_.,C1(=CC(=C(C=C1)C2OC(=CC=2)/C=C3\SC(NC3=O)=O)O)F,199,http://www.selleckchem.com/products/as-252424.html,PI3K/Akt/mTOR,,L1700-Selleck-Bioactive-Compound-Library
SelleckChem004,SP0138-A,O06,Galeterone,S2803,Galeterone,10,m,6,15,25,192947939,388.55,851983-85-2,free base,P450 (e.g. CYP17);Androgen Receptor,Galeterone is a selective CYP17 inhibitor and androgen receptor (AR) antagonist with IC50 of 300 nM and 384 nM; respectively; and is a potent inhibitor of human prostate tumor growth. Phase 2.,[C@]12(C(C3C(CC1)[C@@]4(C(=CC3)C[C@H](CC4)O)C)CC=C2N5C6=C(N=C5)C=CC=C6)C,61,http://www.selleckchem.com/products/galeterone-tok-001.html,Endocrinology & Hormones,,L1700-Selleck-Bioactive-Compound-Library
SelleckChem004,SP0138-A,O07,CAY10505,S2682,CAY10505,10,m,7,15,25,192892652,289.28,1218777-13-9,free base,PI3K,CAY10505 is dehydroxyl of AS-252424; which is a PI3K_ inhibitor with IC50 of 33 nM.,C1(=CC=C(C=C1)C2OC(=CC=2)/C=C3\C(NC(S3)=O)=O)F,200,http://www.selleckchem.com/products/cay10505.html,PI3K/Akt/mTOR,,L1700-Selleck-Bioactive-Compound-Library
SelleckChem004,SP0138-A,O08,Ciproxifan,S2813,Ciproxifan,10,m,8,15,25,192947925,386.4,184025-18-1,maleate,Histamine Receptor,Ciproxifan is a highly potent and selective histamin H3-receptor antagonist with IC50 of 9.2 nM; with low apparent affinity at other receptor subtypes.,C(=O)(C1C=CC(=CC=1)OCCCC2N=CNC=2)C3(CC3).C(/C=C\C(=O)O)(=O)O,139,http://www.selleckchem.com/products/ciproxifan.html,Neuronal Signaling,,L1700-Selleck-Bioactive-Compound-Library
SelleckChem004,SP0138-A,O09,BMY 7378,S2691,BMY 7378,10,m,9,15,25,192917844,458.42,21102-95-4,dihydrochloride,5-HT Receptor,BMY 7378 is a multi-targeted inhibitor of _2C-adrenoceptor and _1D-adrenoceptor with pKi of 6.54 and 8.2; respectively; and acts as a mixed agonist and antagonist for 5-HT1A receptor with pKi of 8.3.,C1(=CC=C(C(=C1)N2CCN(CC2)CCN3C(CC4(CC3=O)CCCC4)=O)OC).Cl.Cl,200,http://www.selleckchem.com/products/bmy-7378.html,Neuronal Signaling,,L1700-Selleck-Bioactive-Compound-Library
