384 Plate ID,Plate Map,Well,Human Readable Name,Catalog No.,MoleculeID,Concentration,Unit,Well X,Well Y,Volume,Barcode,M.w.,CAS Number,Form,Targets,Information,Smiles,Max Solubility in DMSO,URL,Pathway,,Library
SelleckChem004,SP0138-A,A03,TAK-875,S2637,TAK-875,10,m,3,1,25,179712999,533.63,1374598-80-7,hydrate,GPR,TAK-875 is a selective GPR40 agonist with EC50 of 14 nM; 400-fold more potent than oleic acid.,C1(=C(C=C(C=C1)COC2=CC=C3C(=C2)OC[C@H]3CC(=O)O)C4=C(C=C(C=C4C)OCCCS(=O)(C)=O)C).O.C5=C(C=C(C=C5)COC6=CC=C7C(=C6)OC[C@H]7CC(=O)O)C8=C(C=C(C=C8C)OCCCS(=O)(C)=O)C,187,http://www.selleckchem.com/products/tak-875.html,Endocrinology & Hormones,,L1700-Selleck-Bioactive-Compound-Library
SelleckChem004,SP0138-A,A04,RITA (NSC 652287),S2781,RITA (NSC 652287),10,m,4,1,25,179766741,292.37,213261-59-7,free base,E3 Ligase ;p53,RITA (NSC 652287) induces both DNA-protein and DNA-DNA cross-links with no detectable DNA single-strand breaks; and also inhibits MDM2-p53 interaction by targeting p53.,O1C(=CC=C1C2=CC=C(S2)CO)C3=CC=C(S3)CO,198,http://www.selleckchem.com/products/rita-nsc-652287.html,Apoptosis,,L1700-Selleck-Bioactive-Compound-Library
SelleckChem004,SP0138-A,A05,ICG-001,S2662,ICG-001,10,m,5,1,25,179709463,548.63,780757-88-2,free base,Wnt/beta-catenin,ICG-001 antagonizes Wnt/_-catenin/TCF-mediated transcription and specifically binds to element-binding protein (CBP) with IC50 of 3 _M; but is not the related transcriptional coactivator p300.,C1=CC=C(C=C1)CNC(N2[C@@]3(N(C(CC2)=O)[C@@H](C(N(C3)CC4=CC=CC5=C4C=CC=C5)=O)CC6=CC=C(C=C6)O)[H])=O,182,http://www.selleckchem.com/products/icg-001.html,Stem Cells &  Wnt,,L1700-Selleck-Bioactive-Compound-Library
SelleckChem004,SP0138-A,A06,Sotrastaurin,S2791,Sotrastaurin,10,m,6,1,25,192940207,438.48,425637-18-9,free base,PKC,Sotrastaurin is a potent and selective pan-PKC inhibitor; mostly for PKC_ with Ki of 0.22 nM; inactive to PKC_. Phase 1/2.,N1C(C(=C(C1=O)C2N=C(N=C3C=CC=CC=23)N4CCN(CC4)C)C5=CNC6C=CC=CC5=6)=O,198,http://www.selleckchem.com/products/sotrastaurin-aeb071.html,TGF-beta/Smad,,L1700-Selleck-Bioactive-Compound-Library
SelleckChem004,SP0138-A,A07,PF-00562271,S2672,PF-00562271,10,m,7,1,25,192900064,665.66,939791-38-5,benzenesulfonic,FAK,PF-00562271 is the benzenesulfonate salt of PF-562271; which is a potent; ATP-competitive; reversible inhibitor of FAK with IC50 of 1.5 nM; ~10-fold less potent for Pyk2 than FAK and >100-fold selectivity against other protein kinases; except for some CDKs. Phase 1.,C1(=NC(=C(C=C1)CNC2=C(C=NC(=N2)NC3=CC=C4C(=C3)CC(N4)=O)C(F)(F)F)N(C)S(=O)(C)=O).C5=CC=CC(=C5)S(O)(=O)=O,21,http://www.selleckchem.com/products/pf-00562271.html,Angiogenesis,,L1700-Selleck-Bioactive-Compound-Library
SelleckChem004,SP0138-A,A08,Sirtinol,S2804,Sirtinol,10,m,8,1,25,192943335,394.47,410536-97-9,free base,Sirtuin,Sirtinol is a specific SIRT1 and SIRT2 inhibitor with IC50 of 131 _M and 38 _M; respectively.,C(C1C(=CC=CC=1)/N=C/C2C(=CC=C3C=CC=CC=23)O)(=O)NC(C)C4C=CC=CC=4,58,http://www.selleckchem.com/products/sirtinol.html,Epigenetics,,L1700-Selleck-Bioactive-Compound-Library
SelleckChem004,SP0138-A,A09,CHIR-124,S2683,CHIR-124,10,m,9,1,25,194487403,419.91,405168-58-3,free base,Chk,CHIR-124 is a novel and potent Chk1 inhibitor with IC50 of 0.3 nM. It shows 2;000-fold selectivity against Chk2; 500- to 5;000-fold less activity against CDK2/4 and Cdc2.,C1(C(=C(C2=C(N1)C=CC(=C2)Cl)N[C@H]3C4CCN(C3)CC4)C5=NC6=C(N5)C=CC=C6)=O,16,http://www.selleckchem.com/products/chir-124.html,Cell Cycle,,L1700-Selleck-Bioactive-Compound-Library
SelleckChem004,SP0138-A,A10,BYL719,S2814,BYL719,10,m,10,1,25,192878809,441.47,1217486-61-7,free base,PI3K,BYL719 is a potent and selective PI3K_ inhibitor with IC50 of 5 nM; and minimal effect on PI3K_/_/_. Phase 1/2.,N1([C@@H](CCC1)C(=O)N)C(=O)NC2SC(=C(N=2)C)C3=CC(=NC=C3)C(C(F)(F)F)(C)C,199,http://www.selleckchem.com/products/byl719.html,PI3K/Akt/mTOR,,L1700-Selleck-Bioactive-Compound-Library
SelleckChem004,SP0138-A,A11,TG101209,S2692,TG101209,10,m,11,1,25,192953455,509.67,936091-14-4,free base,JAK;FLT3;c-RET,TG101209 is a selective JAK2 inhibitor with IC50 of 6 nM; less potent to Flt3 and RET with IC50 of 25 nM and 17 nM; ~30-fold selective for JAK2 than JAK3; sensitive to JAK2V617F and MPLW515L/K mutations.,C1=C(C=C(C=C1)NC2=NC(=NC=C2C)NC3=CC=C(C=C3)N4CCN(CC4)C)S(NC(C)(C)C)(=O)=O,200,http://www.selleckchem.com/products/tg101209.html,JAK/STAT,,L1700-Selleck-Bioactive-Compound-Library
SelleckChem004,SP0138-A,A12,TPCA-1,S2824,TPCA-1,10,m,12,1,25,192933619,279.29,507475-17-4,free base,I_B/IKK,TPCA-1 is an inhibitor of IKK-2 with IC50 of 17.9 nM; inhibits NF-_B pathway; exhibits 22-fold selectivity over IKK-1.,C1(=C(C=C(S1)C2C=CC(=CC=2)F)C(=O)N)NC(=O)N,200,http://www.selleckchem.com/products/tpca-1.html,NF-_B,,L1700-Selleck-Bioactive-Compound-Library
SelleckChem004,SP0138-A,A13,GSK1838705A,S2703,GSK1838705A,10,m,13,1,25,192892578,532.57,1116235-97-2,free base,IGF-1R;ALK,GSK1838705A is a potent IGF-1R inhibitor with IC50 of 2.0 nM; modestly potent to IR and ALK with IC50 of 1.6 nM and 0.5 nM; respectively; and little activity to other protein kinases.,N1=C(N=C2C(=C1NC3=CC=CC(=C3C(=O)NC)F)C=CN2)NC4=C(C=C5C(=C4)N(CC5)C(=O)CN(C)C)OC,200,http://www.selleckchem.com/products/gsk1838705a.html,Protein Tyrosine Kinase,,L1700-Selleck-Bioactive-Compound-Library
SelleckChem004,SP0138-A,A14,Semaxanib (SU5416),S2845,Semaxanib (SU5416),10,m,14,1,25,192894665,238.28,194413-58-6,free base,VEGFR,Semaxanib (SU5416) is a potent and selective VEGFR(Flk-1/KDR) inhibitor with IC50 of 1.23 _M; 20-fold more selective for VEGFR than PDGFR_; lack of activity against EGFR; InsR and FGFR. Phase 3.,C1=CC=C2C(=C1)/C(C(N2)=O)=C/C3NC(=CC=3C)C,92,http://www.selleckchem.com/products/semaxanib-su5416.html,Protein Tyrosine Kinase,,L1700-Selleck-Bioactive-Compound-Library
SelleckChem004,SP0138-A,A15,Nilvadipine,S2721,Nilvadipine,10,m,15,1,25,179676757,385.37,75530-68-6,free base,Calcium Channel,Nilvadipine is a potent calcium channel blocker with an IC50 of 0.03 nM.,C1(NC(=C(C(C=1C(=O)OC(C)C)C2=CC=CC(=C2)[N+](=O)[O-])C(OC)=O)C#N)C,199,http://www.selleckchem.com/products/nilvadipine-arc029.html,Transmembrane Transporters,,L1700-Selleck-Bioactive-Compound-Library
SelleckChem004,SP0138-A,A16,SB271046,S2856,SB271046,10,m,16,1,25,192918307,451.99,209481-20-9,free base,5-HT Receptor,SB271046 is a potent; selective and orally active 5-HT6 receptor antagonist with pKi of 8.9; exhibits 200-fold greater selectivity over other 5-HT receptor subtypes.,C12C(C(=C(S1)S(=O)(=O)NC3C=C(C(=CC=3)OC)N4CCNCC4)C)=CC(=CC=2)Cl,88,http://www.selleckchem.com/products/sb-271046.html,Neuronal Signaling,,L1700-Selleck-Bioactive-Compound-Library
SelleckChem004,SP0138-A,A17,MK-8776 (SCH 900776),S2735,MK-8776 (SCH 900776),10,m,17,1,25,192889979,376.25,891494-63-6,free base,CDK;Chk,SCH 900776 is a selective Chk1 inhibitor with IC50 of 3 nM. It shows 500-fold selectivity against Chk2. Phase 2.,C12N=C(C(=C(N1N=CC=2C3=CN(N=C3)C)N)Br)[C@H]4CNCCC4,199.34,http://www.selleckchem.com/products/sch-900776.html,Cell Cycle,,L1700-Selleck-Bioactive-Compound-Library
SelleckChem004,SP0138-A,A18,IMD 0354,S2864,IMD 0354,10,m,18,1,25,192900987,383.67,978-62-1,free base,I_B/IKK,IMD-0354 is an IKK_ inhibitor and blocks I_B_ phosphorylation in NF-_B pathway.,C1=CC(=CC(=C1O)C(NC2=CC(=CC(=C2)C(F)(F)F)C(F)(F)F)=O)Cl,26,http://www.selleckchem.com/products/imd-0354.html,NF-_B,,L1700-Selleck-Bioactive-Compound-Library
SelleckChem004,SP0138-A,A19,Anacetrapib (MK-0859),S2748,Anacetrapib (MK-0859),10,m,19,1,25,192948008,637.51,875446-37-0,free base,CETP,Anacetrapib (MK0859) is a potent; selective; reversible rhCETP and mutant CETP(C13S) inhibitor with IC50 of 7.9 nM and 11.8 nM; increases HDL-C and decreases LDL-C; does not increase aldosterone or blood pressure. Phase 3.,C1=C(C=C(C(=C1)C2=CC(=C(C=C2OC)F)C(C)C)CN3C(O[C@@H]([C@H]3C)C4=CC(=CC(=C4)C(F)(F)F)C(F)(F)F)=O)C(F)(F)F,199,http://www.selleckchem.com/products/anacetrapib-mk-0859.html,Metabolism,,L1700-Selleck-Bioactive-Compound-Library
SelleckChem004,SP0138-A,A20,Camostat Mesilate,S2874,Camostat Mesilate,10,m,20,1,25,181344310,494.52,59721-29-8,mesilate,Others,Camostat is a trypsin-like protease inhibitor; inhibits airway epithelial sodium channel (ENaC) function with IC50 of 50 nM; less potent to trpsin; prostasin and matriptase.,C1(C(OC2C=CC(=CC=2)CC(OCC(N(C)C)=O)=O)=O)(C=CC(=CC=1)NC(N)=N).S(C)(O)(=O)=O,200,http://www.selleckchem.com/products/camostat-mesilate-foy-305.html,Others,,L1700-Selleck-Bioactive-Compound-Library
SelleckChem004,SP0138-A,A21,Canagliflozin,S2760,Canagliflozin,10,m,21,1,25,192953961,444.52,842133-18-0,free base,SGLT,Canagliflozin is a highly potent and selective SGLT2 inhibitor for hSGLT2 with IC50 of 2.2 nM; exhibits 413-fold selectivity over hSGLT1.,[C@H]1([C@H]([C@@H]([C@H]([C@@H](O1)C2=CC(=C(C=C2)C)CC3SC(=CC=3)C4=CC=C(C=C4)F)O)O)O)CO,200,http://www.selleckchem.com/products/canagliflozin.html,GPCR & G Protein,,L1700-Selleck-Bioactive-Compound-Library
SelleckChem004,SP0138-A,A22,PF-562271,S2890,PF-562271,10,m,22,1,25,192943357,507.49,717907-75-0,free base,FAK,PF-562271 is a potent; ATP-competitive; reversible inhibitor of FAK with IC50 of 1.5 nM; ~10-fold less potent for Pyk2 than FAK and >100-fold selectivity against other protein kinases; except for some CDKs.,C1=NC(=C(C=C1)CNC2=C(C=NC(=N2)NC3=CC=C4C(=C3)CC(N4)=O)C(F)(F)F)N(C)S(=O)(=O)C,199,http://www.selleckchem.com/products/pf-562271.html,Angiogenesis,,L1700-Selleck-Bioactive-Compound-Library
SelleckChem004,SP0138-A,A23,LPS_A23,,LPS_A23,,,23,1,,,,,,,,,,,,,L1700-Selleck-Bioactive-Compound-Library
SelleckChem004,SP0138-A,A24,LPS_A24,,LPS_A24,,,24,1,,,,,,,,,,,,,L1700-Selleck-Bioactive-Compound-Library
SelleckChem004,SP0138-A,B03,Tempol,S2910,Tempol,10,m,3,2,25,192918183,172.24,2226-96-2,free base,Others,TEMPOL is a superoxide scavenger that displays neuroprotective; anti-inflammatory and analgesic effects.,C1(N(C(CC(C1)O)(C)C)[O])(C)C,197,http://www.selleckchem.com/products/tempol-4-hydroxy-tempo.html,Others,,L1700-Selleck-Bioactive-Compound-Library
SelleckChem004,SP0138-A,B04,Methylthiouracil,S3138,Methylthiouracil,10,m,4,2,25,192872150,142.18,56-04-2,free base,Others,Methylthiouracil is an antithyroid preparation.,C1(NC(C=C(N1)C)=O)=S,196,http://www.selleckchem.com/products/methylthiouracil.html,Others,,L1700-Selleck-Bioactive-Compound-Library
SelleckChem004,SP0138-A,B05,IOX2,S2919,IOX2,10,m,5,2,25,192947105,352.34,931398-72-0,free base,HIF,IOX2 is a potent inhibitor of HIF-1_ prolyl hydroxylase-2 (PHD2) with IC50 of 21 nM; >100-fold selectivity over JMJD2A; JMJD2C; JMJD2E; JMJD3; or the 2OG oxygenase FIH.,C(CNC(=O)C1C(N(C2C=CC=CC(C=1O)=2)CC3C=CC=CC=3)=O)(=O)O,19,http://www.selleckchem.com/products/iox2.html,Angiogenesis,,L1700-Selleck-Bioactive-Compound-Library
SelleckChem004,SP0138-A,B06,Gliquidone,S3151,Gliquidone,10,m,6,2,25,179619158,527.63,33342-05-1,free base,Potassium Channel,Gliquidone is an ATP-sensitive K+ channel antagonist with IC50 of 27.2 nM.,C1(C=CC(=CC=1)CCN2C(C3C=C(C=CC(C(C2=O)(C)C)=3)OC)=O)S(=O)(=O)NC(=O)NC4CCCCC4,199,http://www.selleckchem.com/products/gliquidone.html,Transmembrane Transporters,,L1700-Selleck-Bioactive-Compound-Library
SelleckChem004,SP0138-A,B07,Pifithrin-_ (PFT_),S2929,Pifithrin-_ (PFT_),10,m,7,2,25,192918145,367.3,63208-82-2,HBr,p53;Autophagy,Pifithrin-_ is an inhibitor of p53; inhibiting p53-dependent transactivation of p53-responsive genes.,C1(CCC2=C(C1)N(C(S2)=N)CC(C3=CC=C(C=C3)C)=O).Br,182,http://www.selleckchem.com/products/pifithrin-alpha.html,Apoptosis,,L1700-Selleck-Bioactive-Compound-Library
SelleckChem004,SP0138-A,B08,Ampicillin sodium,S3170,Ampicillin sodium,10,m,8,2,25,179619557,371.39,69-52-3,sodium,Others,Ampicillin is a beta-lactam antibiotic that is part of the aminopenicillin family.,N12([C@H](C(S[C@]([C@@H](C1=O)NC([C@@H](C3C=CC=CC=3)N)=O)2[H])(C)C)C(=O)[O-]).[Na+],99,http://www.selleckchem.com/products/ampicillin-sodium.html,Others,,L1700-Selleck-Bioactive-Compound-Library
SelleckChem004,SP0138-A,B09,Pazopanib,S3012,Pazopanib,10,m,9,2,25,192864579,437.52,444731-52-6,free base,PDGFR;c-Kit;VEGFR,Pazopanib is a novel multi-target inhibitor of VEGFR1; VEGFR2; VEGFR3; PDGFR; FGFR; c-Kit and c-Fms with IC50 of 10 nM; 30 nM; 47 nM; 84 nM; 74 nM; 140 nM and 146 nM; respectively.,C1(C(=CC=C(C=1)NC2N=C(C=CN=2)N(C)C3C=CC4=C(N(N=C(C=3)4)C)C)C)S(=O)(=O)N,201,http://www.selleckchem.com/products/pazopanib.html,Protein Tyrosine Kinase,,L1700-Selleck-Bioactive-Compound-Library
SelleckChem004,SP0138-A,B10,Flumequine,S3181,Flumequine,10,m,10,2,25,179604064,261.25,42835-25-6,free base,Topoisomerase,Flumequine is a synthetic chemotherapeutic antibiotic; inhibiting topoisomerase II with IC50 of 15 _M.,C12C(C(=CN3C(CCC(=C31)C=C(C=2)F)C)C(=O)O)=O,11,http://www.selleckchem.com/products/flumequine.html,DNA Damage,,L1700-Selleck-Bioactive-Compound-Library
SelleckChem004,SP0138-A,B11,Bufexamac,S3023,Bufexamac,10,m,11,2,25,192943030,223.27,2438-72-4,free base,COX,Bufexamac is a COX inhibitor for IFN-_ release with EC50 of 8.9 _M.,C1(C=CC(=CC=1)OCCCC)CC(=O)NO,201,http://www.selleckchem.com/products/bufexamac.html,Neuronal Signaling,,L1700-Selleck-Bioactive-Compound-Library
SelleckChem004,SP0138-A,B12,Azlocillin sodium salt,S3195,Azlocillin sodium salt,10,m,12,2,25,179605045,484.48,37091-65-9,sodium,Others,Azlocillin is an acylampicillin with a broad spectrum against bacteria.,N12(C(C(SC(C(C1=O)NC(=O)[C@@H](C3C=CC=CC=3)NC(=O)N4CCNC4=O)2)(C)C)C(=O)O).[Na],200,http://www.selleckchem.com/products/azlocillin-sodium-salt.html,Others,,L1700-Selleck-Bioactive-Compound-Library
SelleckChem004,SP0138-A,B13,Sitaxentan sodium,S3034,Sitaxentan sodium,10,m,13,2,25,181343431,476.89,210421-74-2,free base,Endothelin Receptor,Sitaxentan sodium is a selective endothelin A receptor (ETA) antagonist with IC50 and Ki of 1.4 nM and 0.43 nM; respectively; exhibits 7000-fold selectivity over ETB. Phase 3.,C1(=C(C=CS1)S(=O)(=O)[N-]C2=C(C(=NO2)C)Cl)C(=O)CC3(C=C4OCOC4=CC=3C).[Na+],83,http://www.selleckchem.com/products/sitaxentan-sodium-tbc-11251.html,GPCR & G Protein,,L1700-Selleck-Bioactive-Compound-Library
SelleckChem004,SP0138-A,B14,Amidopyrine,S3209,Amidopyrine,10,m,14,2,25,179605347,231.29,58-15-1,free base,Others,Amidopyrine is white crystalline substance used as an analgesic and antipyretic.,N1(N(C(C(=C1C)N(C)C)=O)C2C=CC=CC=2)C,198,http://www.selleckchem.com/products/amidopyrine.html,Others,,L1700-Selleck-Bioactive-Compound-Library
SelleckChem004,SP0138-A,B15,Azilsartan,S3046,Azilsartan,10,m,15,2,25,192866488,456.45,147403-03-0,free base,RAAS,Azilsartan is an angiotensin II type 1 (AT1) receptor antagonist with IC50 of 2.6 nM.,C1(=NC2C(N1CC3C=CC(=CC=3)C4C(=CC=CC=4)C5NOC(N=5)=O)=C(C=CC=2)C(=O)O)OCC,199,http://www.selleckchem.com/products/azilsartan-tak-536.html,Endocrinology & Hormones,,L1700-Selleck-Bioactive-Compound-Library
SelleckChem004,SP0138-A,B16,Lithocholic acid,S4003,Lithocholic acid,10,m,16,2,25,179605373,376.57,434-13-9,free base,Others,Lithocholic acid is a toxic secondary bile acid; causes intrahepatic cholestasis; has tumor-promoting activity; its toxic effect can be protected after it activates the vitamin D receptor; PXR and FXR.,[C@@]12([C@]3([C@@]([C@@]4([C@](CC3)(C[C@@H](CC4)O)[H])C)(CC[C@@]1([C@H]([C@@H](CCC(O)=O)C)CC2)C)[H])[H])[H],199,http://www.selleckchem.com/products/lithocholic-acid.html,Others,,L1700-Selleck-Bioactive-Compound-Library
SelleckChem004,SP0138-A,B17,Medetomidine HCl,S3060,Medetomidine HCl,10,m,17,2,25,192925625,236.74,86347-15-1,hydrochloride,Adrenergic Receptor,Medetomidine is a selective _2-adrenoceptor agonist; with Ki of 1.08 nM; exhibts 1620-fold selectivity over _1-adrenoceptor.,C1(=C(C(C)=CC=C1)C)C(C2N=CNC=2)C.Cl,50,http://www.selleckchem.com/products/medetomidine-hcl.html,Neuronal Signaling,,L1700-Selleck-Bioactive-Compound-Library
SelleckChem004,SP0138-A,B18,Hyoscyamine,S4014,Hyoscyamine,10,m,18,2,25,179681674,289.37,101-31-5,free base,AChR,Hyoscyamine is an AChR inhibitor with IC50 of 7.5 nM.,C1(CC2N(C(C1)CC2)C)OC([C@@H](C3C=CC=CC=3)CO)=O,200,http://www.selleckchem.com/products/hyoscyamine-daturine.html,Neuronal Signaling,,L1700-Selleck-Bioactive-Compound-Library
SelleckChem004,SP0138-A,B19,Vanillin ,S3071,Vanillin ,10,m,19,2,25,192942987,152.15,121-33-5,free base,Others,Vanillin; 4-hydroxy-3-methoxybenzaldehyde; is a food additive.,C(C1C=C(C(=CC=1)O)OC)=O,197.17,http://www.selleckchem.com/products/vanillin.html,Others,,L1700-Selleck-Bioactive-Compound-Library
SelleckChem004,SP0138-A,B20,Procaine HCl,S4023,Procaine HCl,10,m,20,2,25,179618928,272.77,51-05-8,hydrochloride,Sodium Channel,Procaine is an inhibitor of sodium channel; NMDA receptor and nAChR with IC50 of 60 _M; 0.296 mM and 45.5 _M; which is also an inhibitor of 5-HT3 with KD of 1.7 _M.,C1(C(OCCN(CC)CC)=O)(C=CC(=CC=1)N).Cl,201,http://www.selleckchem.com/products/procaine-novocaine-hcl.html,Transmembrane Transporters,,L1700-Selleck-Bioactive-Compound-Library
SelleckChem004,SP0138-A,B21,Indacaterol Maleate,S3083,Indacaterol Maleate,10,m,21,2,25,192927544,508.56,753498-25-8,maleate,Adrenergic Receptor,Indacaterol is an ultra-long-acting _-adrenoceptor agonist with pKi of 7.36.,N1(C(C=CC2C(=CC=C(C1=2)O)[C@H](CNC3CC4C=C(C(=CC(C3)=4)CC)CC)O)=O).C(/C(=O)O)=C\C(=O)O,200,http://www.selleckchem.com/products/indacaterol-maleate.html,Neuronal Signaling,,L1700-Selleck-Bioactive-Compound-Library
SelleckChem004,SP0138-A,B22,Doxapram HCl,S4037,Doxapram HCl,10,m,22,2,25,179604292,432.98,7081-53-0,hydrochloride,Others,Doxapram HCl inhibits TASK-1; TASK-3; TASK-1/TASK-3 heterodimeric channel function with EC50 of 410 nM; 37 _M; 9 _M; respectively.,C1(C(C(CCN2CCOCC2)CN1CC)(C3=CC=CC=C3)C4=CC=CC=C4)=O.Cl.O,200,http://www.selleckchem.com/products/doxapram-hcl.html,Others,,L1700-Selleck-Bioactive-Compound-Library
SelleckChem004,SP0138-A,B23,LPS_B23,,LPS_B23,,,23,2,,,,,,,,,,,,,L1700-Selleck-Bioactive-Compound-Library
SelleckChem004,SP0138-A,B24,LPS_B24,,LPS_B24,,,24,2,,,,,,,,,,,,,L1700-Selleck-Bioactive-Compound-Library
SelleckChem004,SP0138-A,C03,NU7441 (KU-57788),S2638,NU7441 (KU-57788),10,m,3,3,25,194487928,413.49,503468-95-9,free base,DNA-PK;PI3K,NU7441 is a highly potent and selective DNA-PK inhibitor with IC50 of 14 nM and also inhibits PI3K with IC50 of 5 _M.,C1=C(OC2=C(C1=O)C=CC=C2C3=CC=CC4=C3SC5=C4C=CC=C5)N6CCOCC6,7.26,http://www.selleckchem.com/products/nu7441.html,DNA Damage,,L1700-Selleck-Bioactive-Compound-Library
SelleckChem004,SP0138-A,C04,GW4064,S2782,GW4064,10,m,4,3,25,179712750,542.84,278779-30-9,free base,FXR,GW4064 is an agonist of farnesoid X receptor (FXR) with EC50 of 65 nM.,C1=CC=C(C=C1C(=O)O)/C=C/C2=C(C=C(C=C2)OCC3C(=NOC=3C(C)C)C4=C(C=CC=C4Cl)Cl)Cl,200,http://www.selleckchem.com/products/gw-4064.html,Others,,L1700-Selleck-Bioactive-Compound-Library
SelleckChem004,SP0138-A,C05,WAY-100635 Maleate,S2663,WAY-100635 Maleate,10,m,5,3,25,192917686,538.64,1092679-51-0,hydrochloride,5-HT Receptor,WAY 100635 is a potent and selective 5-HT1A receptor agonist with pIC50 of 8.87; exhibits >100-fold selectivity against other 5-HT receptor subtypes and major neurotransmitter receptors.,C1(N2CCN(CC2)CCN(C3=CC=CC=N3)C(C4CCCCC4)=O)(=C(C=CC=C1)OC).Cl.Cl.Cl,157,http://www.selleckchem.com/products/way-100635.html,Neuronal Signaling,,L1700-Selleck-Bioactive-Compound-Library
SelleckChem004,SP0138-A,C06,Torcetrapib,S2792,Torcetrapib,10,m,6,3,25,179766924,600.47,262352-17-0,free base,CETP,Torcetrapib is a CETP inhibitor with IC50 of 37 nM; elevates HDL-C and reduces nonHDL-C in plasma. Phase 3.,C12=C(N([C@@H](C[C@H]1N(C(=O)OC)CC3=CC(=CC(=C3)C(F)(F)F)C(F)(F)F)CC)C(OCC)=O)C=CC(=C2)C(F)(F)F,199,http://www.selleckchem.com/products/torcetrapib-cp-529414.html,Metabolism,,L1700-Selleck-Bioactive-Compound-Library
SelleckChem004,SP0138-A,C07,Trametinib (GSK1120212),S2673,Trametinib (GSK1120212),10,m,7,3,25,179619047,615.39,871700-17-3,free base,MEK,Trametinib (GSK1120212) is a highly specific and potent MEK1/2 inhibitor with IC50 of 0.92 nM/1.8 nM; no inhibition of the kinase activities of c-Raf; B-Raf; ERK1/2. Phase 3.,C1(N(C(=C2C(=C1C)N(C(N(C2=O)C3CC3)=O)C4=CC(=CC=C4)NC(C)=O)NC5=CC=C(C=C5F)I)C)=O,162,http://www.selleckchem.com/products/gsk1120212-(jtp-74057).html,MAPK,,L1700-Selleck-Bioactive-Compound-Library
SelleckChem004,SP0138-A,C08,CEP-33779,S2806,CEP-33779,10,m,8,3,25,179702477,462.57,1257704-57-6,free base,JAK,CEP33779 is a selective JAK2 inhibitor with IC50 of 1.8 nM; >40- and >800-fold versus JAK1 and TYK2.,C1(=CC=CC(=C1)NC2N=C3N(N=2)C=CC=C3C4=CC=C(C=C4)S(=O)(C)=O)N5CCN(CC5)C,201,http://www.selleckchem.com/products/cep33779.html,JAK/STAT,,L1700-Selleck-Bioactive-Compound-Library
SelleckChem004,SP0138-A,C09,KW-2478,S2685,KW-2478,10,m,9,3,25,192917124,574.66,819812-04-9,free base,HSP (e.g. HSP90),KW-2478 is a nonansamycin HSP90 inhibitor with IC50 of 3.8 nM. Phase 1/2,C1=C(C(=C(C(=C1O)C(C2=CC=C(C(=C2)OC)OCCN3CCOCC3)=O)CC(N(CCOC)CCOC)=O)CC)O,200,http://www.selleckchem.com/products/kw-2478.html,Cytoskeletal Signaling,,L1700-Selleck-Bioactive-Compound-Library
SelleckChem004,SP0138-A,C10,Tyrphostin AG 879,S2816,Tyrphostin AG 879,10,m,10,3,25,194487639,316.46,148741-30-4,free base,HER2,Tyrphostin AG 879 potently inhibits HER2/ErbB2 with IC50 of 1 _M; 100- and 500-fold higher selective to ErbB2 than PDGFR and EGFR.,C(/C(=C/C1C=C(C(=C(C=1)C(C)(C)C)O)C(C)(C)C)C#N)(N)=S,113,http://www.selleckchem.com/products/tyrphostin-ag-879-ag-879.html,Protein Tyrosine Kinase,,L1700-Selleck-Bioactive-Compound-Library
SelleckChem004,SP0138-A,C11,Resminostat,S2693,Resminostat,10,m,11,3,25,192893001,349.4,864814-88-0,free base,HDAC,Resminostat dose-dependently and selectively inhibits HDAC1/3/6 with IC50 of 42.5 nM/50.1 nM/71.8 nM; less potent to HDAC8 with IC50 of 877 nM.,C1=C(C=CC(=C1)CN(C)C)S(N2C=CC(=C2)/C=C/C(NO)=O)(=O)=O,200,http://www.selleckchem.com/products/resminostat-ras2410.html,Epigenetics,,L1700-Selleck-Bioactive-Compound-Library
SelleckChem004,SP0138-A,C12,ML133 HCl,S2825,ML133 HCl,10,m,12,3,25,192919571,313.82,1222781-70-5,hydrochloride,Potassium Channel,ML133 is a selective potassium channel inhibitor for Kir2.1 with IC50 of 1.8 _M (pH 7.4) and 290 nM (pH 8.5); has no effect on Kir1.1 and weak activity for Kir4.1 and Kir7.1.,C1(=CC2=C(C=C1)C(=CC=C2)CNCC3=CC=C(C=C3)OC).Cl,200,http://www.selleckchem.com/products/Ml-133-hcl.html,Transmembrane Transporters,,L1700-Selleck-Bioactive-Compound-Library
SelleckChem004,SP0138-A,C13,YO-01027,S2711,YO-01027,10,m,13,3,25,192953340,463.48,209984-56-5,free base,Gamma-secretase,YO-01027 (Dibenzazepine; DBZ) is a dipeptidic _-secretase inhibitor with IC50 of 2.6 nM and 2.9 nM for APPL and Notch cleavage; respectively.,C1(=CC(=CC(=C1)CC(N[C@H](C(N[C@H]2C3=C(C4=C(N(C2=O)C)C=CC=C4)C=CC=C3)=O)C)=O)F)F,200,http://www.selleckchem.com/products/yo-01027.html,Proteases,,L1700-Selleck-Bioactive-Compound-Library
SelleckChem004,SP0138-A,C14,Cathepsin Inhibitor 1,S2847,Cathepsin Inhibitor 1,10,m,14,3,25,179727730,401.89,225120-65-0,free base,Others,Cathepsin Inhibitor 1 is an inhibitor of Cathepsin (L; L2; S; K; B) with pIC50 of 7.9; 6.7; 6.0; 5.5 and 5.2; respectively. ,N1(N=C(C=C1C(=O)N[C@H](C(=O)NCC#N)CC2C=C(C=CC=2)Cl)C(C)(C)C)C,199,http://www.selleckchem.com/products/cathepsin-Inhibitor-1.html,Others,,L1700-Selleck-Bioactive-Compound-Library
SelleckChem004,SP0138-A,C15,JTC-801,S2722,JTC-801,10,m,15,3,25,192948071,447.96,244218-51-7,hydrochloride,Opioid Receptor,JTC-801 is a selective opioid receptor-like1 (ORL1) receptor antagonist with IC50 of 94 nM; weakly inhibits receptors _; _; and _.,C1(=CC=C(C(=C1)C(=O)NC2=CC3=C(C=C2)N=C(C=C3N)C)COC4=CC=C(C=C4)CC).Cl,200,http://www.selleckchem.com/products/jtc-801.html,Neuronal Signaling,,L1700-Selleck-Bioactive-Compound-Library
SelleckChem004,SP0138-A,C16,MK-801 (Dizocilpine),S2857,MK-801 (Dizocilpine),10,m,16,3,25,192917111,221.3,77086-21-6,free base,GluR,Dizocilpine is a potent N-methyl-D-aspartate (NMDA) receptor antagonist with Ki of 30.5 nM.,C12=C([C@]3(C4=C([C@@H](C1)N3)C=CC=C4)C)C=CC=C2,302,http://www.selleckchem.com/products/dizocilpine-mk-801.html,Neuronal Signaling,,L1700-Selleck-Bioactive-Compound-Library
SelleckChem004,SP0138-A,C17,TG101348 (SAR302503),S2736,TG101348 (SAR302503),10,m,17,3,25,192953009,524.68,936091-26-8,free base,JAK,TG-101348 (SAR302503) is a selective inhibitor of JAK2 with IC50 of 3 nM; 35- and 334-fold more selective for JAK2 versus JAK1 and JAK3. Phase 1/2.,C1(=CC=C(C=C1)NC2=NC(=C(C=N2)C)NC3=CC=CC(=C3)S(NC(C)(C)C)(=O)=O)OCCN4CCCC4,190,http://www.selleckchem.com/products/tg-101348.html,JAK/STAT,,L1700-Selleck-Bioactive-Compound-Library
SelleckChem004,SP0138-A,C18,VUF 10166,S2865,VUF 10166,10,m,18,3,25,192918194,262.74,155584-74-0,free base,5-HT Receptor,VUF10166 is a novel; potent and competitive antagonist for 5-HT3A receptor with Ki of 0.04 nM; its affinity at 5-HT3AB receptor is significantly lower.,C1=CC=C2C(=C1)N=C(C(=N2)Cl)N3CCN(CC3)C,79,http://www.selleckchem.com/products/vuf-10166.html,Neuronal Signaling,,L1700-Selleck-Bioactive-Compound-Library
SelleckChem004,SP0138-A,C19,BGT226 (NVP-BGT226),S2749,BGT226 (NVP-BGT226),10,m,19,3,25,192900406,650.6,1245537-68-1,free base,PI3K;mTOR,NVP-BGT226 is a novel class I PI3K/mTOR inhibitor for PI3K_/_/_ with IC50 of 4 nM/63 nM/38 nM. Phase 1/2.,C(/C=C\C(=O)O)(=O)O.N1=CC2=C(C3=CC(=CC=C13)C4C=NC(=CC=4)OC)N(C(N2C)=O)C5C=C(C(=CC=5)N6CCNCC6)C(F)(F)F,46,http://www.selleckchem.com/products/nvp-bgt226.html,PI3K/Akt/mTOR,,L1700-Selleck-Bioactive-Compound-Library
SelleckChem004,SP0138-A,C20,Prucalopride,S2875,Prucalopride,10,m,20,3,25,192918155,367.87,179474-81-8,free base,5-HT Receptor,Prucalopride is a selective; high affinity 5-HT receptor agonist for 5-HT4A and 5-HT4B receptor with Ki of 2.5 nM and 8 nM; respectively; exhibits >290-fold selectivity against other 5-HT receptor subtypes. Phase 3.,C1(C2=C(CCO2)C(=C(C=1)Cl)N)C(NC3CCN(CC3)CCCOC)=O,163,http://www.selleckchem.com/products/prucalopride.html,Neuronal Signaling,,L1700-Selleck-Bioactive-Compound-Library
