SelleckChem007,SP0141-A,I11,Probucol,S2119,Probucol,10,m,11,9,25,192869956,516.84,23288-49-5,free base,Others,Probucol is an anti-hyperlipidemic drug by lowering the level of cholesterol in the bloodstream by increasing the rate of LDL catabolism.,C1(=C(C(=CC(=C1)SC(SC2C=C(C(=C(C=2)C(C)(C)C)O)C(C)(C)C)(C)C)C(C)(C)C)O)C(C)(C)C,199,http://www.selleckchem.com/products/probucol.html,Others
SelleckChem007,SP0141-A,I12,Azomycin,S2267,Azomycin,10,m,12,9,25,192864717,113.07,527-73-1,free base,Others,Azomycin is an antimicrobial antibiotic produced by a strain of Nocardia mesenterica.,O=[N+](C1=NC=CN1)[O-],203,http://www.selleckchem.com/products/Azomycin(2-Nitroimidazole).html,Others
SelleckChem007,SP0141-A,I13,Gastrodin,S2383,Gastrodin,10,m,13,9,25,192874766,286.28,62499-27-8,free base,Others,Gastrodin; an anti-inflammatory polyphenol extracted from Chinese natural herbal Gastrodia elata Blume.; benefits neurodegenerative diseases.,[C@@H]1([C@@H]([C@H]([C@@H](O[C@H]1CO)OC2=CC=C(C=C2)CO)O)O)O,174,http://www.selleckchem.com/products/Gastrodin(Gastrodine).html,Others
SelleckChem007,SP0141-A,I14,Tenoxicam,S2512,Tenoxicam,10,m,14,9,25,192890998,337.37832,59804-37-4,free base,Others,Tenoxicam is a good HO. radicals scavenger with an IC50 of 56.7 _M,C1=CC=C(N=C1)NC(=O)C2N(S(C3=C(C=2O)SC=C3)(=O)=O)C,201,http://www.selleckchem.com/products/Tenoxicam(Mobiflex).html,Others
SelleckChem007,SP0141-A,I15,NPS-2143,S2633,NPS-2143,10,m,15,9,25,192881999,408.92,284035-33-2,free base,CaSR,NPS 2143 is a novel potent and selective antagonist of Ca(2+) receptor with IC50 of 43 nM.,C1(=CC=CC(=C1C#N)OC[C@@H](CNC(CC2=CC=C3C(=C2)C=CC=C3)(C)C)O)Cl,200,http://www.selleckchem.com/products/nps-2143.html,GPCR & G Protein
SelleckChem007,SP0141-A,I16,PF-5274857,S2777,PF-5274857,10,m,16,9,25,192896129,436.96,1373615-35-0,free base,Hedgehog/Smoothened,PF-5274857 is a potent and selective Smoothened (Smo) antagonist; inhibits Hedgehog (Hh) signaling with IC50 and Ki of 5.8 nM and 4.6 nM; respectively; and can penetrate the blood_brain barrier.,C1(=CC(=C(N=C1)C2=CC(=NC=C2Cl)N3CCN(CC3)C(=O)CCS(C)(=O)=O)C)C,212,http://www.selleckchem.com/products/pf-5274857.html,Stem Cells &  Wnt
SelleckChem007,SP0141-A,I17,PF 477736,S2904 ,PF 477736,10,m,17,9,25,192891628,419.48,952021-60-2,,Chk-1/-2 Inhibitor,PF-477736 is a selective; potent and ATP-competitive Chk1 inhibitor with Ki of 0.49 nM and also inhibits VEGFR2; Aurora-A; FGFR3; Flt3; Fms (CSF1R); Ret and Yes. It shows ~100-fold selectivity for Chk1 than Chk2. Phase 1. ,C1C(CCCC1)[C@@H](N)C(=O)NC2=CC3=C4C(=C2)C(NN=CC(=C(N3)C5C=NN(C=5)C)4)=O,14.3,https://www.selleckchem.com/products/pf-477736.html,Cell Cycle
SelleckChem007,SP0141-A,I18,Biotin (Vitamin B7),S3130,Biotin (Vitamin B7),10,m,18,9,25,192931860,244.31,58-85-5,free base,Others,Biotin is a water-soluble B-vitamin and is necessary for cell growth; the production of fatty acids; and the metabolism of fats and amino acids.,C1(N[C@@]2([C@](N1)([C@H](SC2)CCCCC(=O)O)[H])[H])=O,200,http://www.selleckchem.com/products/biotin-vitamin-b7.html,Others
SelleckChem007,SP0141-A,I19,Valdecoxib,S4049,Valdecoxib,10,m,19,9,25,179602798,314.36,181695-72-7,free base,COX,Valdecoxib is a potent and selective inhibitor of COX-2 with IC50 of 5 nM.,C1=CC=CC(=C1)C2=NOC(=C2C3=CC=C(C=C3)S(N)(=O)=O)C,200,http://www.selleckchem.com/products/valdecoxib.html,Neuronal Signaling
SelleckChem007,SP0141-A,I20,Teriflunomide,S4169,Teriflunomide,10,m,20,9,25,192872598,270.21,108605-62-5,free base,Others,Teriflunomide is the active metabolite of leflunomide; inhibiting pyrimidine de novo synthesis by blocking the enzyme dihydroorotate dehydrogenase; used as an immunomodulatory agent.,C1(=CC=C(C=C1)C(F)(F)F)NC(/C(=C(/C)O)C#N)=O,118,http://www.selleckchem.com/products/teriflunomide.html,Others
SelleckChem007,SP0141-A,I21,Oxiracetam,S4270,Oxiracetam,10,m,21,9,25,192916474,158.16,62613-82-5,Free Base,Others,Oxiracetam; a cyclic derivative of gamma-aminobutyric acid (GABA); is used as a nootropic drug to improve memory and learning.,N1(CC(O)CC1=O)CC(N)=O,31,www.selleckchem.com/products/oxiracetam.html,Others
SelleckChem007,SP0141-A,I22,Aceclidine HCl,S4376,Aceclidine HCl,10,m,22,9,25,179607899,205.68,6109-70-2,,,,CC(=O)OC1CN2CCC1CC2.Cl,,,,Does not exist on SelleckChem site
SelleckChem007,SP0141-A,J01,DMSO_J01,,DMSO_J01,,,1,10
SelleckChem007,SP0141-A,J02,DMSO_J02,,DMSO_J02,,,2,10
SelleckChem007,SP0141-A,J03,GSK923295,S7090,GSK923295,10,m,3,10,25,192916644,592.13,1088965-37-0,Free Base,Kinesin,GSK923295 is a first-in-class; specific allosteric inhibitor of CENP-E kinesin motor ATPase with Ki of 3.2 nM; and less potent to mutant I182 and T183. Phase 1. ,C(C1C=C(C(=CC=1)OC(C)C)Cl)(=O)N[C@H](CNC(CN(C)C)=O)CC2C=CC(=CC=2)C3N=C4C(=CC=CN4C=3)[C@H](C)O,100,www.selleckchem.com/products/gsk923295.html,Cytoskeletal Signaling
SelleckChem007,SP0141-A,J04,AZD1981,S7263,AZD1981,10,m,4,10,25,192932418,388.87,802904-66-1,free base,GPR,AZD1981 is a potent; selective CRTh2 (DP2) receptor antagonist with IC50 of 4 nM; showing >1000-fold selectivity over more than 340 other enzymes and receptors; including DP1.,C1=CC(=C2C(=C1)N(C(=C2SC3=CC=C(C=C3)Cl)C)CC(=O)O)NC(C)=O,28,http://www.selleckchem.com/products/azd1981.html,Endocrinology & Hormones
SelleckChem007,SP0141-A,J05,VER-50589,S7459,VER-50589,10,m,5,10,25,192930183,388.8,747413-08-7,Free Base,HSP (e.g. HSP90),"VER-50589 is a potent HSP90 inhibitor with IC50 of 21 nM for HSP90_.
SelleckChem007,SP0141-A,J06,Sabutoclax,S8061,Sabutoclax,10,m,6,10,25,192884169,700.78,1228108-65-3,Free Base,Bcl-2,Sabutoclax(BI-97C1) is a pan-Bcl-2 inhibitor; including Bcl-xL; Bcl-2; Mcl-1 and Bfl-1 with IC50  of 0.31 _M; 0.32 _M; 0.20 _M and 0.62 _M; respectively.,C1(=C(C(=C2C(=C1)C(=C(C(=C2)C)C3=C(C4=C(C=C3C)C(=C(C(=C4)O)O)C(=O)NC[C@H](C)C5=CC=CC=C5)O)O)C(=O)NC[C@H](C)C6=CC=CC=C6)O)O,100,www.selleckchem.com/products/sabutoclax.html,Apoptosis
SelleckChem007,SP0141-A,K01,DMSO_K01,,DMSO_K01,,,1,11
SelleckChem007,SP0141-A,K02,DMSO_K02,,DMSO_K02,,,2,11
SelleckChem007,SP0141-A,K03,Saracatinib (AZD0530),S1006,Saracatinib (AZD0530),10,m,3,11,25,192904584,542.03,379231-04-6,free base,Src;Bcr-Abl,Saracatinib (AZD0530) is a potent Src inhibitor with IC50 of 2.7 nM; and potent to c-Yes; Fyn; Lyn; Blk; Fgr and Lck; less active for Abl and EGFR (L858R and L861Q). Phase 1/2.,C1=C(C=C2C(=C1OC3CCOCC3)C(=NC=N2)NC4=C(C=CC5=C4OCO5)Cl)OCCN6CCN(CC6)C,184,http://www.selleckchem.com/products/AZD0530.html,Angiogenesis
SelleckChem007,SP0141-A,K04,Triciribine,S1117,Triciribine,10,m,4,11,25,192897701,320.3,35943-35-2,free base,Akt,Triciribine is a DNA synthesis inhibitor; also inhibits Akt and HIV-1 with IC50 of 130 nM and 20 nM; respectively; does not inhibit PI3K/PDK1; 5000-fold less active in cells lacking adenosine kinase. Phase 1/2.,[C@H]1([C@@H]([C@H](O[C@@H]1N2C3=C4C(=C2)C(=NN(C4=NC=N3)C)N)CO)O)O,199,http://www.selleckchem.com/products/Triciribine.html,PI3K/Akt/mTOR
SelleckChem007,SP0141-A,K05,Etoposide,S1225,Etoposide,10,m,5,11,25,192877808,588.56,33419-42-0,free base,Topoisomerase,Etoposide is a semisynthetic derivative of podophyllotoxin; which inhibits DNA synthesis via topoisomerase II  inhibition activity.,[C@@]12([C@@]([C@@H](C3=C([C@@H]1C4=CC(=C(C(=C4)OC)O)OC)C=C5C(=C3)OCO5)O[C@@]6(O[C@]7([C@]([C@@H]([C@@H]6O)O)(O[C@@H](OC7)C)[H])[H])[H])(COC2=O)[H])[H],169,http://www.selleckchem.com/products/Etopophos.html,DNA Damage
SelleckChem007,SP0141-A,K06,Doripenem Hydrate,S1374,Doripenem Hydrate,10,m,6,11,25,192864274,438.52,364622-82-2,hydrate,Others,Doripenem Hydrate is an ultra-broad spectrum injectable antibiotic.,C1([C@]([C@]2(N1C(=C([C@H]2C)S[C@@H]3CN[C@@H](C3)CNS(N)(=O)=O)C(=O)O)[H])([C@H](C)O)[H])=O.O,82,http://www.selleckchem.com/products/Doripenem-Hydrate.html,Others
SelleckChem007,SP0141-A,K07,Pracinostat (SB939),S1515,Pracinostat (SB939),10,m,7,11,25,181354833,358.48,929016-96-6,free base,HDAC,SB939 is a potent pan-HDAC inhibitor with IC50 of 40-140 nM with exception for HDAC6. It has no activity against the class III isoenzyme SIRT I. Phase 2.,C1(=CC=C2C(=C1)N=C(N2CCN(CC)CC)CCCC)/C=C/C(NO)=O,200,http://www.selleckchem.com/products/SB939.html,Cytoskeletal Signaling
SelleckChem007,SP0141-A,K08,Ezetimibe ,S1655,Ezetimibe ,10,m,8,11,25,192898771,409.4,163222-33-1,free base,Others,Ezetimibe (Zetia) is a compound that lowers cholesterol.,C1=C(C=CC(=C1)[C@H](CC[C@H]2C(N([C@H]2C3=CC=C(C=C3)O)C4=CC=C(C=C4)F)=O)O)F,200,http://www.selleckchem.com/products/Ezetimibe(Zetia).html,Others
SelleckChem007,SP0141-A,K09,Acadesine,S1802,Acadesine,10,m,9,11,25,192903953,258.23,2627-69-2,free base,AMPK,Acadesine results in accumulation of ZMP; which mimics the stimulating effect of AMP on AMPK and AMPK kinase. Phase 3.,[C@@H]1([C@H]([C@@H](O[C@H]1CO)N2C=NC(=C2N)C(=O)N)O)O,197.5,http://www.selleckchem.com/products/Acadesine.html,PI3K/Akt/mTOR
SelleckChem007,SP0141-A,K10,Methscopolamine,S1978,Methscopolamine,10,m,10,11,25,192899821,398.29,155-41-9,bromide,AChR,Methscopolamine (Pamine) is a muscarinic acetylcholine receptor blocker. ,[Br-].[C@]12([C@@]3([C@]([C@@]([N+]1(C)C)(C[C@H](C2)OC([C@@H](C4=CC=CC=C4)CO)=O)[H])(O3)[H])[H])[H],200,http://www.selleckchem.com/products/Methscopolamine-bromide(Pamine).html,Neuronal Signaling
SelleckChem007,SP0141-A,K11,Arbidol HCl,S2120,Arbidol HCl,10,m,11,11,25,192870843,513.88,131707-23-8,hydrochloride,Others,Arbidol is an antiviral treatment for influenza infection.,C1(=C(C=C2C(=C1CN(C)C)C(=C(N2C)CSC3=CC=CC=C3)C(OCC)=O)Br)O.Cl,200,http://www.selleckchem.com/products/Arbidol-hcl.html,Others
SelleckChem007,SP0141-A,K12,Baicalein,S2268,Baicalein,10,m,12,11,25,192957686,270.24,491-67-8,free base,P450 (e.g. CYP17),Baicalein is a CYP2C9 and prolyl endopeptidase inhibitor. ,C1(=C(C(=C2C(=C1)OC(=CC2=O)C3=CC=CC=C3)O)O)O,199,http://www.selleckchem.com/products/Baicalein.html,Metabolism
SelleckChem007,SP0141-A,K13,Hematoxylin,S2384,Hematoxylin,10,m,13,11,25,192872869,302.28,517-28-2,free base,Others,Hematoxylin (Hydroxybrazilin) is a compound that forms strongly colored complexes with certain metal ions; notably Fe(III) and Al(III) salts and a kind of stain in histology.,[C@]12([C@@](C3=C(OC1)C(=C(C=C3)O)O)(C4=C(C2)C=C(C(=C4)O)O)[H])O,201,http://www.selleckchem.com/products/Hematoxylin(Hydroxybrazilin).html,Others
SelleckChem007,SP0141-A,K14,Vardenafil HCl Trihydrate,S2515,Vardenafil HCl Trihydrate,10,m,14,11,25,192865828,579.11,224785-90-4,dydrate,PDE,Vardenafil HCl Trihydrate is a new type PDE inhibitor with IC50 of 0.7 and 180 nM for PDE5 and PDE1; respectively.,C1(N(CCN(C1)S(C2=CC=C(C(=C2)C3=NN4C(C(N3)=O)=C(N=C4CCC)C)OCC)(=O)=O)CC).Cl.O.O.O,200,http://www.selleckchem.com/products/Vardenafil(Vivanza).html,Metabolism
SelleckChem007,SP0141-A,K15,DCC-2036 (Rebastinib),S2634,DCC-2036 (Rebastinib),10,m,15,11,25,192913809,553.59,1020172-07-9,free base,Bcr-Abl,DCC-2036 is a conformational control Bcr-Abl inhibitor for Abl1(WT) and Abl1(T315I) with IC50 of 0.8 nM and 4 nM; also inhibits SRC; LYN; FGR; HCK; KDR; FLT3; and Tie-2; and low activity to seen towards c-Kit. Phase 1/2.,C1(=C(C=C(C=C1)OC2=CC(=NC=C2)C(NC)=O)F)NC(NC3N(N=C(C=3)C(C)(C)C)C4=CC5=C(C=C4)N=CC=C5)=O,200,http://www.selleckchem.com/products/dcc-2036.html,Angiogenesis
SelleckChem007,SP0141-A,K16,GW842166X,S2778,GW842166X,10,m,16,11,25,192948054,449.25,666260-75-9,free base,Cannabinoid Receptor,GW842166X is a potent and highly selective agonist of cannabinoid receptor CB2 receptor with EC50 of 63 nM; shows no significant activity at CB1 receptor. Phase 2.,C1(N=C(C(=CN=1)C(=O)NCC2CCOCC2)C(F)(F)F)NC3C(=CC(=CC=3)Cl)Cl,44,http://www.selleckchem.com/products/gw-842166x.html,GPCR & G Protein
SelleckChem007,SP0141-A,K17,JNJ-7777120,S2905,JNJ-7777120,10,m,17,11,25,192947916,277.75,459168-41-3,free base,Histamine Receptor,JNJ-7777120 is the first potent and selective non-imidazole histamine H4 receptor antagonist with Ki of 4.5 nM; exhibits >1000-fold selectivity over the other histamin receptors.,C1(=CC=C2C(=C1)C=C(N2)C(N3CCN(CC3)C)=O)Cl,201,http://www.selleckchem.com/products/jnj-7777120.html,Neuronal Signaling
SelleckChem007,SP0141-A,K18,Sulfamerazine,S3132,Sulfamerazine,10,m,18,11,25,192882160,264.3,127-79-7,free base,Others,Sulfamerazine is a sulfonamide antibacterial.,C1(C=CC(=CC=1)N)S(=O)(=O)NC2N=C(C=CN=2)C,200,http://www.selleckchem.com/products/sulfamerazine.html,Others
SelleckChem007,SP0141-A,K19,Valganciclovir HCl,S4050,Valganciclovir HCl,10,m,19,11,25,192881228,390.82,175865-59-5,hydrochloride,Others,Valganciclovir HCl is a prodrug for ganciclovir with antiviral activity used to treat cytomegalovirus infections. ,C(C)(C)[C@@H](C(OCC(CO)OCN1C=NC2C1N=C(NC2=O)N)=O)N.Cl,199,http://www.selleckchem.com/products/valganciclovir-hcl.html,Others
SelleckChem007,SP0141-A,K20,Coumarin,S4170,Coumarin,10,m,20,11,25,192920548,146.14,91-64-5,free base,Others,Coumarin is a secondary phytochemical with hepatotoxic and carcinogenic properties.,O1C(=O)C=CC2C=CC=CC1=2,198,http://www.selleckchem.com/products/coumarin.html,Others
SelleckChem007,SP0141-A,K21,3-Aminobenzamide ,S4273,3-Aminobenzamide ,10,m,21,11,25,194474443,136.15,3544-24-9,Free Base,PARP,"3-Aminobenzamide is a competitive PARP inhibitor with Ki of 1.8 _M.
SelleckChem007,SP0141-A,K22,Imipramine HCl,S4377,Imipramine HCl,10,m,22,11,25,179607874,316.87,113-52-0,Neurological Disease,Others,Imipramine is a tricyclic antidepressant (TCA) of the dibenzazepine group; mainly used in the treatment of major depression and enuresis (inability to control urination).,CN(C)CCCN1C2=CC=CC=C2CCC3=CC=CC=C31.Cl,198.82,https://www.selleckchem.com/products/imipramine-hcl.html,Others
SelleckChem007,SP0141-A,L01,DMSO_L01,,DMSO_L01,,,1,12
SelleckChem007,SP0141-A,L02,DMSO_L02,,DMSO_L02,,,2,12
SelleckChem007,SP0141-A,L03,Zotarolimus(ABT-578),S7091,Zotarolimus(ABT-578),10,m,3,12,25,192899553,966.21,221877-54-9,Free Base,mTOR,Zotarolimus (ABT-578) is an analogue of rapamycin; and inhibits FKBP-12 binding with IC50 of 2.8 nM.,[C@H]1(CC[C@@H]2O[C@@]1(C(=O)C(=O)N3[C@@](CCCC3)(C(O[C@@H](CC([C@@H](/C=C(/[C@H]([C@H](C([C@@H](C[C@@H](/C=C/C=C/C=C(/[C@H](C2)OC)C)C)C)=O)OC)O)C)C)=O)[C@@H](C[C@@H]4CC[C@@H]([C@@H](C4)OC)N5N=NN=C5)C)=O)[H])O)C,100,www.selleckchem.com/products/zotarolimus-abt-578.html,PI3K/Akt/mTOR
SelleckChem007,SP0141-A,L04,MM-102,S7265,MM-102,10,m,4,12,25,192945402,669.8,1417329-24-8,free base,Histone Methyltransferase,MM-102 is a high-affinity peptidomimetic MLL1 inhibitor with IC50 of 0.4 _M.,C1CC(CC1)(NC([C@@H](NC(=O)C(NC(=O)C(C)C)(CC)CC)CCCNC(N)=N)=O)C(=O)NC(C2=CC=C(C=C2)F)C3=CC=C(C=C3)F,149,http://www.selleckchem.com/products/mm-102.html,Epigenetics
SelleckChem007,SP0141-A,L05,BTB06584,S7460,BTB06584,10,m,5,12,25,181360659,417.82,219793-45-0,free base,Fo-ATPase,BTB06584 is an IF1-dependent; selective inhibitor of the mitochondrial F1 Fo-ATPase.,C1=CC=C(C=C1)S(=O)(=O)C2=CC(=C(C=C2)[N+](=O)[O-])OC(=O)C3=CC=C(C=C3)Cl,201,http://www.selleckchem.com/products/btb06584.html,Transmembrane Transporters
SelleckChem007,SP0141-A,L06,Nutlin-3b,S8065,Nutlin-3b,10,m,6,12,25,192884233,581.49,675576-97-3,Free Base,Mdm2,Nutlin-3b is a p53/MDM2 antagonist or inhibitor with IC50 value of 13.6 _M; 150-fold less potent (+)-enantiomer of Nutlin-3 as in comparison with opposite (-)-enantiomer Nutlin-3a. ,N1(C(=N[C@@H]([C@H]1C2=CC=C(C=C2)Cl)C3=CC=C(C=C3)Cl)C4=CC=C(C=C4OC(C)C)OC)C(N5CC(NCC5)=O)=O,100,www.selleckchem.com/products/nutlin-3b.html,Apoptosis
SelleckChem007,SP0141-A,M01,DMSO_M01,,DMSO_M01,,,1,13
SelleckChem007,SP0141-A,M02,DMSO_M02,,DMSO_M02,,,2,13
SelleckChem007,SP0141-A,M03,FG-4592,S1007,FG-4592,10,m,3,13,25,192948352,352.34,808118-40-3,free base,HIF,FG-4592 is an HIF _ prolyl hydroxylase inhibitor; stabilizes HIF-2 and induces EPO production. Phase 2/3.,C12=C(C(=NC(=C1O)C(NCC(O)=O)=O)C)C=C(C=C2)OC3=CC=CC=C3,201,http://www.selleckchem.com/products/fg-4592.html,Angiogenesis
SelleckChem007,SP0141-A,M04,XL147,S1118,XL147,10,m,4,13,25,194486530,448.52,956958-53-5,free base,PI3K,XL147 is a selective and reversible class I PI3K inhibitor for PI3K_/_/_ with IC50 of 39 nM/36 nM/23 nM; less potent to PI3K_. Phase 1/2.,C1=CC=C2C(=C1)N=C(C(=N2)NS(=O)(=O)C3=CC=C(C=C3)C)NC4=CC5C(C=C4)=NSN=5,10,http://www.selleckchem.com/products/XL147.html,PI3K/Akt/mTOR
SelleckChem007,SP0141-A,M05,KU-0063794,S1226,KU-0063794,10,m,5,13,25,194486984,465.54,938440-64-3,free base,mTOR,KU-0063794 is a potent and highly specific dual-mTOR inhibitor of mTORC1 and mTORC2 with IC50 of ~10 nM; no effect on PI3Ks.,N1=C(N=C2C(=C1N3CCOCC3)C=CC(=N2)C4=CC(=C(C=C4)OC)CO)N5C[C@H](O[C@H](C5)C)C,34,http://www.selleckchem.com/products/KU-0063794.html,PI3K/Akt/mTOR
SelleckChem007,SP0141-A,M06,Gestodene,S1376,Gestodene,10,m,6,13,25,192879098,310.43,60282-87-3,free base,Estrogen/progestogen Receptor,Gestodene is a progestogen hormonal contraceptive.,C1C(C=C2[C@](C1)([C@]3([C@@](CC2)([C@]4([C@](CC3)([C@@](C=C4)(O)C#C)CC)[H])[H])[H])[H])=O,199,http://www.selleckchem.com/products/Gestodene.html,Endocrinology & Hormones
SelleckChem007,SP0141-A,M07,Natamycin ,S1517,Natamycin ,10,m,7,13,25,192896437,665.73,7681-93-8,free base,Others,Natamycin  is a naturally occurring antifungal agent.,[C@@H]1([C@@H]([C@H](O[C@]([C@@H]1O)(O[C@H]2/C=C/C=C/C=C/C=C/C[C@H](OC(=O)/C=C/[C@@H]3[C@@](C[C@@H](C[C@@]4(C[C@@H]([C@H]([C@@](O4)(C2)[H])C(=O)O)O)O)O)(O3)[H])C)[H])C)O)N,150.21,http://www.selleckchem.com/products/Natamycin(Pimaricin).html,Others
SelleckChem007,SP0141-A,M08,Enalaprilat Dihydrate,S1657,Enalaprilat Dihydrate,10,m,8,13,25,192896771,348.4,84680-54-6,dihydrate,RAAS,Enalaprilat is an angiotensin-converting enzyme (ACE) inhibitor with IC50 of 1.94 nM.,C1(=CC=CC(=C1)CC[C@@H](C(O)=O)N[C@H](C(N2[C@@H](CCC2)C(=O)O)=O)C).O.O,200,http://www.selleckchem.com/products/Enalaprilat.html,Endocrinology & Hormones
SelleckChem007,SP0141-A,M09,Acetylcholine Chloride,S1805,Acetylcholine Chloride,10,m,9,13,25,192927445,181.66,60-31-1,chloride,AChR,The chemical compound acetylcholine (ACh) is a neurotransmitter in both the peripheral nervous system (PNS) and central nervous system (CNS) in many organisms including humans. ,CC(OCC[N+](C)(C)C)=O.[Cl-],198,http://www.selleckchem.com/products/Acetylcholine-chloride.html,Neuronal Signaling
SelleckChem007,SP0141-A,M10,Amiodarone HCl,S1979,Amiodarone HCl,10,m,10,13,25,192909566,681.77,19774-82-4,hydrochloride,Autophagy;Potassium Channel,Amiodarone HCl is an antiarrhythmic drug for inhibition of ATP-sensitive potassium channel with IC50 of 19.1 _M.,C1(=C(C=C(C=C1I)C(=O)C2=C(OC3=C2C=CC=C3)CCCC)I)OCCN(CC)CC.Cl,33,http://www.selleckchem.com/products/amiodarone-hcl.html,Transmembrane Transporters
SelleckChem007,SP0141-A,M11,Licofelone,S2121,Licofelone,10,m,11,13,25,192891143,379.88,156897-06-2,free base,COX,Licofelone is a dual COX/LOX inhibitor being considered as a treatment for osteoarthritis.,C1(C2=CC=C(C=C2)Cl)C(=C3N(C=1CC(=O)O)CC(C3)(C)C)C4=CC=CC=C4,200,http://www.selleckchem.com/products/licofelone.html,Neuronal Signaling
SelleckChem007,SP0141-A,M12,Baicalin,S2269,Baicalin,10,m,12,13,25,192949781,446.36,21967-41-9,free base,Others,Baicalin is a known prolyl endopeptidase inhibitor and affects the GABA receptors.,[C@@H]1([C@@H]([C@H]([C@H](O[C@H]1C(=O)O)OC2=C(O)C(=C3C(=C2)OC(=CC3=O)C4=CC=CC=C4)O)O)O)O,199,http://www.selleckchem.com/products/Baicalin.html,Others
SelleckChem007,SP0141-A,M13,Hordenine,S2385,Hordenine,10,m,13,13,25,192874814,165.23,539-15-1,free base,Others,Hordenine (N;N-dimethyl-4-hydroxyphenylethylamine) is a phenylethylamine alkaloid with antibacterial and antibiotic properties.,C1=C(C=CC(=C1)CCN(C)C)O,199,http://www.selleckchem.com/products/Hordenine.html,Others
SelleckChem007,SP0141-A,M14,Xylazine HCl,S2516,Xylazine HCl,10,m,14,13,25,192953528,256.79,23076-35-9,hydrochloride,Adrenergic Receptor,Xylazine HCl is _2 class of adrenergic receptor agonist.,C1(=CC=C(C(=C1C)NC2SCCCN=2)C).Cl,194,http://www.selleckchem.com/products/Xylazine(Rompun).html,Neuronal Signaling
SelleckChem007,SP0141-A,M15,CCT128930,S2635,CCT128930,10,m,15,13,25,192900788,341.84,885499-61-6,free base,Akt,CCT128930 is a potent; ATP-competitive and selective inhibitor of Akt2 with IC50 of 6 nM; 28-fold greater selectivity for Akt2 than the closely related PKA kinase.,N1=CN=C2C(=C1N3CCC(CC3)(N)CC4=CC=C(C=C4)Cl)C=CN2,198,http://www.selleckchem.com/products/cct128930.html,PI3K/Akt/mTOR
SelleckChem007,SP0141-A,M16,M344,S2779,M344,10,m,16,13,25,192953396,307.39,251456-60-7,free base,HDAC,M344 is a potent HDAC inhibitor with IC50 of 100 nM and able to induce cell differentiation.,C1(=CC=C(C=C1)C(NCCCCCCC(NO)=O)=O)N(C)C,201,http://www.selleckchem.com/products/m344.html,Cytoskeletal Signaling
SelleckChem007,SP0141-A,M17,Ki16198,S2906,Ki16198,10,m,17,13,25,192948199,488.98,355025-13-7,free base,LPA Receptor,Ki16198 is the methyl ester of Ki16425; which is a LPA antagonist and inhibits LPA1- and LPA3-induced inositol phosphate production with Ki of 0.34 _M and 0.93 _M; respectively; shows weaker inhibition for LPA2; no activity at LPA4; LPA5; LPA6.,C1=CC(=CC=C1C2=C(C(=NO2)C)NC(OC(C3=C(C=CC=C3)Cl)C)=O)CSCCC(OC)=O,196,http://www.selleckchem.com/products/ki16198.html,GPCR & G Protein
SelleckChem007,SP0141-A,M18,Sulfamethazine,S3133,Sulfamethazine,10,m,18,13,25,192882197,278.33,57-68-1,free base,Others,Sulfamethazine is a sulfonamide antibacterial.,C1=C(C=CC(=C1)S(NC2=NC(=CC(=N2)C)C)(=O)=O)N,201,http://www.selleckchem.com/products/sulfamethazine.html,Others
SelleckChem007,SP0141-A,M19,Nabumetone,S4051,Nabumetone,10,m,19,13,25,179618492,228.29,42924-53-8,free base,COX,Nabumetone is a non-steroidal anti-inflammatory drug and its active metabolite inhibits the COX.,C1(=CC=C2C(=C1)C=CC(=C2)CCC(C)=O)OC,201,http://www.selleckchem.com/products/nabumetone.html,Neuronal Signaling
SelleckChem007,SP0141-A,M20,Choline Chloride,S4171,Choline Chloride,10,m,20,13,25,192920418,139.62,67-48-1,chloride,Others,Choline chloride is a quaternary ammonium salt used as an additive for animal feed.,C([N+](C)(C)C)CO.[Cl-],200,http://www.selleckchem.com/products/choline-chloride.html,Others
SelleckChem007,SP0141-A,M21,Rotigotine,S4274,Rotigotine,10,m,21,13,25,179617858,315.47,99755-59-6,Free Base,Dopamine Receptor,"Rotigotine is a dopamine receptor agonist; used in the treatment of Parkinson's disease and restless legs syndrome.
SelleckChem007,SP0141-A,M22,Methylhydantoin-5-(D),S4378,Methylhydantoin-5-(D),10,m,22,13,25,192955185,114.1,55147-68-7,,,,C[C@H]1NC(=O)NC1=O,,,,Does not exist on SelleckChem site
SelleckChem007,SP0141-A,N01,DMSO_N01,,DMSO_N01,,,1,14
SelleckChem007,SP0141-A,N02,DMSO_N02,,DMSO_N02,,,2,14
SelleckChem007,SP0141-A,N03,SANT-1,S7092,SANT-1,10,m,3,14,25,192932329,373.49,304909-07-7,free base,Hedgehog/Smoothened,SANT-1 directly binds to Smoothened (Smo) receptor with Kd of 1.2 nM and inhibits Smo agonist effects with IC50 of 20 nM.,C1=CC=CC=C1N2N=C(C(=C2C)/C=N/N3CCN(CC3)CC4=CC=CC=C4)C,56,http://www.selleckchem.com/products/sant-1.html,Stem Cells &  Wnt
SelleckChem007,SP0141-A,N04,Golgicide A,S7266,Golgicide A,10,m,4,14,25,179740232,284.3,1139889-93-2,free base,ATPase,Golgicide A is a potent and rapidly reversible GBF1 inhibitor.,N1=CC=CC(=C1)C2NC3=C([C@@]4([C@@]2(CC=C4)[H])[H])C=C(C=C3F)F,200,http://www.selleckchem.com/products/golgicide-a.html,Transmembrane Transporters
SelleckChem007,SP0141-A,N05,LDC000067,S7461,LDC000067,10,m,5,14,25,192960888,370.43,1073485-20-7,Free Base,CDK,"LDC000067 is a highly selective CDK9 inhibitor with IC50 of 44 nM; 55/125/210/ >227/ >227-fold selectivity over CDK2/1/4/6/7.
SelleckChem007,SP0141-A,N06,NSC 405020,S8072,NSC 405020,10,m,6,14,25,192931321,260.16,7/6/1997,free base,MMP,NSC 405020 is a noncatalytic inhibitor of MT1-MMP; directly interacts with PEX domain of MT1-MMP; affects PEX homodimerization but not catalytic activity of MT1-MMP.,C1=C(C(=CC(=C1)C(NC(CCC)C)=O)Cl)Cl,199,http://www.selleckchem.com/products/nsc-405020.html,Proteases
SelleckChem007,SP0141-A,O01,DMSO_O01,,DMSO_O01,,,1,15
SelleckChem007,SP0141-A,O02,DMSO_O02,,DMSO_O02,,,2,15
SelleckChem007,SP0141-A,O03,Selumetinib (AZD6244),S1008,Selumetinib (AZD6244),10,m,3,15,25,192895131,457.68,606143-52-6,free base,MEK,Selumetinib (AZD6244) is a potent; highly selective MEK1 inhibitor with IC50 of 14 nM; also inhibits ERK1/2 phosphorylation with IC50 of 10 nM; no inhibition to p38_; MKK6; EGFR; ErbB2; ERK2; B-Raf; etc. Phase 1/2.,C1=C2C(=C(C(=C1C(NOCCO)=O)NC3=CC=C(C=C3Cl)Br)F)N=CN2C,201,http://www.selleckchem.com/products/AZD6244.html,MAPK
SelleckChem007,SP0141-A,O04,Cabozantinib (XL184; BMS-907351),S1119,Cabozantinib (XL184; BMS-907351),10,m,4,15,25,194472604,501.51,849217-68-1,free base,FLT3;Tie-2;c-Kit;c-Met;VEGFR;Axl,Cabozantinib (XL184; BMS-907351) is a potent VEGFR2 inhibitor with IC50 of 0.035 nM and also inhibits c-Met; Ret; Kit; Flt-1/3/4; Tie2; and AXL with IC50 of 1.3 nM; 4 nM; 4.6 nM; 12 nM/11.3 nM/6 nM; 14.3 nM and 7 nM; respectively.,C12=C(C(=CC=N1)OC3=CC=C(C=C3)NC(C4(C(NC5=CC=C(C=C5)F)=O)CC4)=O)C=C(C(=C2)OC)OC,199,http://www.selleckchem.com/products/XL184.html,Protein Tyrosine Kinase
SelleckChem007,SP0141-A,O05,Raloxifene HCl,S1227,Raloxifene HCl,10,m,5,15,25,192931943,510.04,82640-04-8,hydrochloride,Estrogen/progestogen Receptor,Raloxifene is estrogen antagonists; inhibits human cytosolic aldehyde oxidase-catalyzed phthalazine oxidation activity with IC50 of 5.7 nM.,C1(C=CC2=C(C=1)SC(=C2C(C3=CC=C(C=C3)OCCN4CCCCC4)=O)C5=CC=C(C=C5)O)O.Cl,199,http://www.selleckchem.com/products/Evista.html,Endocrinology & Hormones
SelleckChem007,SP0141-A,O06,Drospirenone,S1377,Drospirenone,10,m,6,15,25,192879700,366.49,67392-87-4,free base,Estrogen/progestogen Receptor,Drospirenone is a synthetic progestin that is an analog to spironolactone.,C1C(C=C2[C@](C1)([C@]3([C@@]([C@@]4([C@]2(C4)[H])[H])([C@]5([C@](CC3)([C@@]6([C@@]7([C@]5(C7)[H])[H])OC(CC6)=O)C)[H])[H])[H])C)=O,199,http://www.selleckchem.com/products/Drospirenone.html,Endocrinology & Hormones
